id,pred_label,orig_len,aug_len,aligned_tokens,kendall_tau,top_k_overlap,cosine_similarity,flip,text,aug_text
547,0,28,28,28,0.8253968253968254,0.9,0.9948118545373793,False,"the film is based on truth and yet there is something about it that feels incomplete , as if the real story starts just around the corner . ","the film is based on truth and yet there is something about it that feels incomplete , as if the real story depart just around the corner . "
602,1,11,11,11,0.38181818181818183,0.9,0.9631795626708958,False,"instead , he shows them the respect they are due . ","alternatively , he shows them the esteem they are due . "
282,0,29,29,29,0.27586206896551724,0.6,0.8440440094034158,False,"while there 's something intrinsically funny about sir anthony hopkins saying ` get in the car , bitch , ' this jerry bruckheimer production has little else to offer ","while thither 'sulphur something intrinsically funny about sir anthony hopkins saying ` get in the car , bitch , ' this jerry bruckheimer production has little else to offer "
683,0,22,22,22,0.5411255411255411,0.9,0.9287236788410348,False,true tale of courage -- and complicity -- at auschwitz is a harrowing drama that tries to tell of the unspeakable . ,true tale of courage -- and complicity -- at auschwitz is a harrowing drama that tries to tell of the dreadful . 
10,1,16,16,16,0.06666666666666667,0.6,0.6812551928630632,False,the mesmerizing performances of the leads keep the film grounded and keep the audience riveted . ,the hypnotic performances of the leads dungeon the film grounded and keep the audience center . 
391,0,23,23,23,0.7707509881422925,0.8,0.9610322740224905,False,... plays like somebody spliced random moments of a chris rock routine into what is otherwise a cliche-riddled but self-serious spy thriller . ,... plays like mortal spliced random moments of a chris shake routine into what is otherwise a cliche-riddled but self-serious spy thriller . 
128,1,28,28,27,0.5270655270655271,0.9,0.7119843806537092,False,montias ... pumps a lot of energy into his nicely nuanced narrative and surrounds himself with a cast of quirky -- but not stereotyped -- street characters . ,Montia ... pumps a lot of push into his nicely nuanced narrative and surrounds himself with a cast of quirky -- but not stereotyped -- street characters . 
24,1,16,16,16,0.2833333333333333,0.8,0.4904051358055017,False,seldom has a movie so closely matched the spirit of a man and his work . ,seldom has a pic thus nearly matched the spirit of a man and his work . 
270,1,9,9,9,1.0,1.0,0.9999999999999998,False,dense with characters and contains some thrilling moments . ,dense with characters and contains some thrilling moments . 
607,1,6,6,6,0.4666666666666667,1.0,0.8934726597477508,False,ahhhh ... revenge is sweet ! ,ahhhh ... retaliation is sweet ! 
333,1,21,21,21,0.6857142857142857,0.9,0.9656148934014279,False,"a pleasant enough romance with intellectual underpinnings , the kind of movie that entertains even as it turns maddeningly predictable . ","a pleasant adequate romance with intellectual underpinnings , the kind of movie that entertains even as it turns maddeningly predictable . "
