id,pred_label,orig_len,aug_len,aligned_tokens,kendall_tau,top_k_overlap,cosine_similarity,flip,text,aug_text
168,1,12,12,12,1.0,1.0,1.0000000000000002,False,manages to be sweet and wickedly satisfying at the same time . ,manages to be sweet and wickedly satisfying at the same time . 
428,1,7,7,7,1.0,1.0,1.0,False,"beautifully observed , miraculously unsentimental comedy-drama . ","beautifully observed , miraculously unsentimental comedy-drama . "
706,0,6,6,6,1.0,1.0,1.0,False,how do you spell cliché ? ,how do you spell cliché ? 
870,0,11,11,11,1.0,1.0,1.0,False,... is an arthritic attempt at directing by callie khouri . ,... is an arthritic attempt at directing by callie khouri . 
650,0,10,10,10,1.0,1.0,1.0,False,"too slow , too long and too little happens . ","too slow , too long and too little happens . "
288,1,32,32,32,0.7137096774193549,0.8,0.9692415815765063,False,the quality of the art combined with the humor and intelligence of the script allow the filmmakers to present the biblical message of forgiveness without it ever becoming preachy or syrupy . ,the caliber of the art combined with the humor and intelligence of the script allow the filmmaker to present the biblical message of forgiveness without it ever becoming preachy or cloying . 
490,0,7,7,7,1.0,1.0,1.0,False,detox is ultimately a pointless endeavor . ,detox is ultimately a pointless endeavor . 
863,0,34,34,34,0.46524064171123,0.6,0.7078253431249529,False,"while it 's genuinely cool to hear characters talk about early rap records ( sugar hill gang , etc. ) , the constant referencing of hip-hop arcana can alienate even the savviest audiences . ","while it 's genuinely cool to hear characters talk about former belt records ( sugar hill gang , etc. ) , the constant referencing of hip-hop arcana can disaffect even the savviest audiences . "
221,0,8,8,8,1.0,1.0,1.0,False,my reaction in a word : disappointment . ,my reaction in a word : disappointment . 
811,0,31,31,31,0.9225806451612903,1.0,0.9990280486814025,False,the affectionate loopiness that once seemed congenital to demme 's perspective has a tough time emerging from between the badly dated cutesy-pie mystery scenario and the newfangled hollywood post-production effects . ,the affectionate loopiness that once seemed congenital to demme 's perspective has a tough time emerging from between the badly dated cutesy-pie mystery scenario and the newfangled hollywood post-production outcome . 
486,0,23,23,23,1.0,1.0,0.9999999999999999,False,the script is n't very good ; not even someone as gifted as hoffman ( the actor ) can make it work . ,the script is n't very good ; not even someone as gifted as hoffman ( the actor ) can make it work . 
827,0,26,26,26,0.6184615384615385,0.9,0.8953946996831945,False,"the movie , directed by mick jackson , leaves no cliche unturned , from the predictable plot to the characters straight out of central casting . ","the movie , directed by mick jackson , provide no cliche unturned , from the predictable diagram to the characters straight out of central casting . "
524,1,31,31,30,0.5586206896551724,0.9,0.9418033927019989,False,the fly-on-the-wall method used to document rural french school life is a refreshing departure from the now more prevalent technique of the docu-makers being a visible part of their work . ,the fly-on-the-wall method used to document rural Gallic school life is a freshen departure from the now more prevalent technique of the docu-makers being a visible part of their work . 
187,1,19,19,19,0.6842105263157895,1.0,0.9703373265392297,False,` de niro ... is a veritable source of sincere passion that this hollywood contrivance orbits around . ' ,` de niro ... is a unquestionable source of sincere passion that this hollywood contrivance orbits around . ' 
517,1,21,21,20,0.08421052631578947,0.6,0.6214045569695713,False,"not far beneath the surface , this reconfigured tale asks disturbing questions about those things we expect from military epics . ","not Interahamwe below the surface , this reconfigured tale asks disturbing questions nigh those things we expect from military epics . "
540,1,9,9,9,1.0,1.0,0.9999999999999998,False,binoche makes it interesting trying to find out . ,binoche makes it interesting trying to find out . 
241,0,14,14,14,0.8681318681318682,1.0,0.9945100804606071,False,it appears that something has been lost in the translation to the screen . ,it appears that something has been lost in the rendering to the screen . 
807,1,10,10,10,1.0,1.0,1.0,False,"just as moving , uplifting and funny as ever . ","just as moving , uplifting and funny as ever . "
3,1,20,20,20,0.5684210526315789,0.8,0.8124542232148904,False,"the acting , costumes , music , cinematography and sound are all astounding given the production 's austere locales . ","the acting , costumes , music , cinematography and sound are all astonishing given the production 's spartan locales . "
14,0,25,25,25,1.0,1.0,0.9999999999999999,False,even horror fans will most likely not find what they 're seeking with trouble every day ; the movie lacks both thrills and humor . ,even horror fans will most likely not find what they 're seeking with trouble every day ; the movie lacks both thrills and humor . 
379,0,17,17,17,1.0,1.0,1.0,False,tries to add some spice to its quirky sentiments but the taste is all too familiar . ,tries to add some spice to its quirky sentiments but the taste is all too familiar . 
599,0,6,6,6,1.0,1.0,1.0,False,big fat waste of time . ,big fat waste of time . 
438,1,44,44,44,0.7272727272727273,0.8,0.9765503146640726,False,"the movie has an infectious exuberance that will engage anyone with a passing interest in the skate/surf culture , the l.a. beach scene and the imaginative ( and sometimes illegal ) ways kids can make a playground out of the refuse of adults . ","the movie has an infectious exuberance that will engage anyone with a passing interest in the skate/surf culture , the l.a. beach scene and the inventive ( and sometimes illegal ) ways kids can make a playground out of the refuse of adults . "
70,0,27,27,27,0.6410256410256411,0.8,0.8570058402341596,False,"for all its impressive craftsmanship , and despite an overbearing series of third-act crescendos , lily chou-chou never really builds up a head of emotional steam . ","for completely its impressive craftsmanship , and despite an overbearing series of third-act crescendos , lily chou-chou never really build up a head of emotional steam . "
148,0,16,16,16,1.0,1.0,0.9999999999999998,False,feels too formulaic and too familiar to produce the transgressive thrills of early underground work . ,feels too formulaic and too familiar to produce the transgressive thrills of early underground work . 
812,1,12,12,12,1.0,1.0,1.0,False,this surreal gilliam-esque film is also a troubling interpretation of ecclesiastes . ,this surreal gilliam-esque film is also a troubling interpretation of ecclesiastes . 
769,1,15,15,15,0.7142857142857143,0.8,0.9655082198068843,False,an infectious cultural fable with a tasty balance of family drama and frenetic comedy . ,an infectious cultural fable with a tasty balance of family drama and frenzied comedy . 
237,0,13,13,13,0.8205128205128205,0.9,0.9835040388902211,False,a by-the-numbers effort that wo n't do much to enhance the franchise . ,a by-the-numbers exploit that wo n't do much to enhance the franchise . 
238,0,11,11,10,0.7777777777777778,1.0,0.9932839941283881,False,"an occasionally funny , but overall limp , fish-out-of-water story . ","an occasionally funny , but overall limp , fish-out-of-irrigate story . "
710,0,15,15,15,0.6571428571428571,0.9,0.7932455810978268,False,"less dizzying than just dizzy , the jaunt is practically over before it begins . ","less dizzying than just dizzy , the outing is practically over before it begins . "
43,1,11,11,11,0.8909090909090909,1.0,0.935706619865001,False,holm ... embodies the character with an effortlessly regal charisma . ,holm ... embodies the character with an effortlessly purple charisma . 
447,1,23,23,23,0.9051383399209486,1.0,0.9957077754755798,False,"generally , clockstoppers will fulfill your wildest fantasies about being a different kind of time traveler , while happily killing 94 minutes . ","generally , clockstoppers will fulfill your wildest fantasies about being a different kind of time traveller , while happily killing 94 minutes . "
756,0,6,6,6,1.0,1.0,1.0,False,something like scrubbing the toilet . ,something like scrubbing the toilet . 
789,0,40,40,40,0.6,0.6,0.8684661557670454,False,"it 's as if you 're watching a movie that was made in 1978 but not released then because it was so weak , and it has been unearthed and released now , when it has become even weaker . ","it 's as if you 're watching a movie that was made in 1978 but not released then because it was so weak , and it has been unearthed and released now , when it experience become even weaker . "
416,1,5,5,5,0.8,1.0,0.9766272738995208,False,a giggle a minute . ,a giggle a arcminute . 
630,1,16,16,15,0.6761904761904762,0.9,0.966601033072207,False,a taut psychological thriller that does n't waste a moment of its two-hour running time . ,a tight psychological thriller that coif n't waste a moment of IT two-hour running time . 
452,0,33,33,33,0.8560606060606061,0.9,0.9979760360790106,False,"it 's clear the filmmakers were n't sure where they wanted their story to go , and even more clear that they lack the skills to get us to this undetermined destination . ","it 'siemens clear the filmmakers were n't sure where they wanted their story to go , and even more clear that they lack the skills to get us to this undetermined destination . "
34,0,20,20,20,1.0,1.0,1.0,False,"it does n't believe in itself , it has no sense of humor ... it 's just plain bored . ","it does n't believe in itself , it has no sense of humor ... it 's just plain bored . "
336,1,29,29,28,0.6296296296296297,0.8,0.9570227724888845,False,"having had the good sense to cast actors who are , generally speaking , adored by the movie-going public , khouri then gets terrific performances from them all . ","having had the proficient sense to cast actors who are , generally speaking , idolized by the film-going public , khouri then gets terrific performances from them whole . "
553,1,22,22,22,1.0,1.0,1.0000000000000002,False,"so unassuming and pure of heart , you ca n't help but warmly extend your arms and yell ` safe ! ' ","so unassuming and pure of heart , you ca n't help but warmly extend your arms and yell ` safe ! ' "
509,1,22,22,22,1.0,1.0,1.0,False,a movie that successfully crushes a best selling novel into a timeframe that mandates that you avoid the godzilla sized soda . ,a movie that successfully crushes a best selling novel into a timeframe that mandates that you avoid the godzilla sized soda . 
842,0,15,15,15,1.0,1.0,1.0,False,"a better title , for all concerned , might be swept under the rug . ","a better title , for all concerned , might be swept under the rug . "
118,1,20,20,20,1.0,1.0,1.0000000000000002,False,every nanosecond of the the new guy reminds you that you could be doing something else far more pleasurable . ,every nanosecond of the the new guy reminds you that you could be doing something else far more pleasurable . 
664,1,35,35,35,0.6739495798319328,0.7,0.9114918676978119,False,"the film is beautifully mounted , but , more to the point , the issues are subtly presented , managing to walk a fine line with regard to the question of joan 's madness . ","the film is beautifully mounted , but , more to the dot , the issues are subtly presented , do to walk a fine line with regard to the question of joan 's madness . "
377,0,7,7,7,1.0,1.0,1.0,False,nothing is sacred in this gut-buster . ,nothing is sacred in this gut-buster . 
23,1,16,16,16,0.9166666666666666,0.9,0.9850480258709028,False,"a delectable and intriguing thriller filled with surprises , read my lips is an original . ","a delectable and intriguing thriller filled with surprises , learn my lips is an original . "
158,1,33,33,33,0.5378787878787878,0.8,0.781881866396081,False,"by getting myself wrapped up in the visuals and eccentricities of many of the characters , i found myself confused when it came time to get to the heart of the movie . ","by getting myself wrapped upwards in the visuals and eccentricities of many of the characters , i found myself confused when it came time to get to the heart of the movie . "
758,1,42,42,42,1.0,1.0,1.0000000000000002,False,"may be far from the best of the series , but it 's assured , wonderfully respectful of its past and thrilling enough to make it abundantly clear that this movie phenomenon has once again reinvented itself for a new generation . ","may be far from the best of the series , but it 's assured , wonderfully respectful of its past and thrilling enough to make it abundantly clear that this movie phenomenon has once again reinvented itself for a new generation . "
90,1,16,16,16,1.0,1.0,1.0000000000000002,False,"it 's a scattershot affair , but when it hits its mark it 's brilliant . ","it 's a scattershot affair , but when it hits its mark it 's brilliant . "
127,0,35,35,35,0.4890756302521008,0.6,0.8378382152957335,False,"in the end , we are left with something like two ships passing in the night rather than any insights into gay love , chinese society or the price one pays for being dishonest . ","in the end , we are left with something like two ships passing in the night preferably than any insights into gay love , chinese society or the price one pay for being dishonest . "
20,0,32,32,32,0.7419354838709677,1.0,0.9833997948214361,False,"pumpkin takes an admirable look at the hypocrisy of political correctness , but it does so with such an uneven tone that you never know when humor ends and tragedy begins . ","pumpkin takes an admirable look at the hypocrisy of political correctness , but it does so with such an uneven tone that you never know when humor ends and calamity begins . "
464,0,16,16,16,1.0,1.0,1.0,False,intriguing documentary which is emotionally diluted by focusing on the story 's least interesting subject . ,intriguing documentary which is emotionally diluted by focusing on the story 's least interesting subject . 
164,1,11,11,11,1.0,1.0,1.0000000000000002,False,a woman 's pic directed with resonance by ilya chaiken . ,a woman 's pic directed with resonance by ilya chaiken . 
565,1,17,17,17,1.0,1.0,1.0,False,there are some wonderfully fresh moments that smooth the moral stiffness with human kindness and hopefulness . ,there are some wonderfully fresh moments that smooth the moral stiffness with human kindness and hopefulness . 
745,0,14,14,14,1.0,1.0,1.0,False,made with no discernible craft and monstrously sanctimonious in dealing with childhood loss . ,made with no discernible craft and monstrously sanctimonious in dealing with childhood loss . 
351,1,25,25,25,1.0,1.0,0.9999999999999999,False,"( næs ) directed the stage version of elling , and gets fine performances from his two leads who originated the characters on stage . ","( næs ) directed the stage version of elling , and gets fine performances from his two leads who originated the characters on stage . "
410,1,27,27,27,1.0,1.0,0.9999999999999998,False,what distinguishes time of favor from countless other thrillers is its underlying concern with the consequences of words and with the complicated emotions fueling terrorist acts . ,what distinguishes time of favor from countless other thrillers is its underlying concern with the consequences of words and with the complicated emotions fueling terrorist acts . 
496,0,14,14,14,1.0,1.0,1.0000000000000002,False,"it 's about following your dreams , no matter what your parents think . ","it 's about following your dreams , no matter what your parents think . "
154,1,9,9,9,0.7777777777777778,1.0,0.877868046185998,False,a solid examination of the male midlife crisis . ,a solid scrutiny of the male midlife crisis . 
191,1,31,31,31,0.35913978494623655,0.6,0.7674648198208094,False,the movie is beautiful to behold and engages one in a sense of epic struggle -- inner and outer -- that 's all too rare in hollywood 's hastier productions . ,the movie is beautiful to behold and rent one in a sense of epic struggle -- inner and outer -- that 's all too rare in hollywood 'second headlong productions . 
681,0,9,9,9,1.0,1.0,0.9999999999999998,False,( a ) shapeless blob of desperate entertainment . ,( a ) shapeless blob of desperate entertainment . 
38,1,23,23,23,0.8814229249011858,0.8,0.9918277054936683,False,"as surreal as a dream and as detailed as a photograph , as visually dexterous as it is at times imaginatively overwhelming . ","as surreal as a dream and as detailed as a pic , as visually dexterous as it is at times imaginatively overwhelming . "
481,1,5,5,5,1.0,1.0,0.9999999999999998,False,funny but perilously slight . ,funny but perilously slight . 
240,1,16,16,16,0.6666666666666666,0.9,0.9169641409837186,False,"despite the 2-d animation , the wild thornberrys movie makes for a surprisingly cinematic experience . ","despite the 2-d animation , the unwarranted thornberrys movie makes for a surprisingly cinematic experience . "
76,0,13,13,13,1.0,1.0,1.0000000000000002,False,the movie fails to live up to the sum of its parts . ,the movie fails to live up to the sum of its parts . 
798,0,35,35,35,1.0,1.0,0.9999999999999999,False,"though moonlight mile is replete with acclaimed actors and actresses and tackles a subject that 's potentially moving , the movie is too predictable and too self-conscious to reach a level of high drama . ","though moonlight mile is replete with acclaimed actors and actresses and tackles a subject that 's potentially moving , the movie is too predictable and too self-conscious to reach a level of high drama . "
202,0,17,17,17,1.0,1.0,1.0,False,"there ought to be a directing license , so that ed burns can have his revoked . ","there ought to be a directing license , so that ed burns can have his revoked . "
213,1,23,23,23,1.0,1.0,0.9999999999999998,False,"this time mr. burns is trying something in the martin scorsese street-realist mode , but his self-regarding sentimentality trips him up again . ","this time mr. burns is trying something in the martin scorsese street-realist mode , but his self-regarding sentimentality trips him up again . "
689,0,25,25,25,0.5933333333333334,0.8,0.9095277766371819,False,"once the 50 year old benigni appears as the title character , we find ourselves longing for the block of wood to come back . ","once the 50 year old benigni appears as the title character , we obtain ourselves longing for the block of wood to follow back . "
673,0,30,30,30,0.696551724137931,0.8,0.9652930238386298,False,"drops you into a dizzying , volatile , pressure-cooker of a situation that quickly snowballs out of control , while focusing on the what much more than the why . ","drops you into a dizzying , volatile , pressure-cooker of a situation that quickly snowballs out of control , while centre on the what often more than the why . "
772,1,34,34,34,0.5650623885918004,0.8,0.9138565641578553,False,"not the kind of film that will appeal to a mainstream american audience , but there is a certain charm about the film that makes it a suitable entry into the fest circuit . ","not the kind of celluloid that will appeal to a mainstream american audience , but there is a certain charm about the film that makes it a suitable entry into the fest circuit . "
781,0,6,6,6,1.0,1.0,0.9999999999999999,False,at once half-baked and overheated . ,at once half-baked and overheated . 
594,1,30,30,30,0.825287356321839,1.0,0.9905819383757961,False,"building slowly and subtly , the film , sporting a breezy spontaneity and realistically drawn characterizations , develops into a significant character study that is both moving and wise . ","building lento and subtly , the film , sporting a windy spontaneity and realistically drawn characterizations , develops into a significant character study that is both moving and wise . "
747,1,29,29,28,0.582010582010582,0.6,0.8261511036444875,False,"what 's surprising about full frontal is that despite its overt self-awareness , parts of the movie still manage to break past the artifice and thoroughly engage you . ","what 's surprising about full frontal is that despite IT overt self-awareness , role of the movie still manage to break past the ruse and exhaustively engage you . "
72,1,8,8,8,1.0,1.0,1.0000000000000002,False,uses high comedy to evoke surprising poignance . ,uses high comedy to evoke surprising poignance . 
125,1,25,25,25,0.4666666666666667,0.5,0.9291284956586228,False,a movie that reminds us of just how exciting and satisfying the fantasy cinema can be when it 's approached with imagination and flair . ,a movie that reminds uracil of just how exciting and satisfying the fantasy cinema can be when it 's approached with imagination and genius . 
573,1,4,4,4,1.0,1.0,1.0,False,lovely and poignant . ,lovely and poignant . 
487,0,18,18,18,0.7777777777777778,0.9,0.9872651821816693,False,"( e ) ventually , every idea in this film is flushed down the latrine of heroism . ","( e ) ventually , every idea in this picture is flushed down the latrine of heroism . "
572,0,13,13,13,0.48717948717948717,1.0,0.6525076320474589,False,the film 's tone and pacing are off almost from the get-go . ,the film 's tone and step are off almost from the get-go . 
397,1,24,24,24,0.8695652173913043,0.9,0.9912058286864418,False,"it 's worth seeing just on the basis of the wisdom , and at times , the startling optimism , of the children . ","it 's worth seeing just on the basis of the soundness , and at times , the startling optimism , of the children . "
205,1,10,10,10,0.4666666666666667,1.0,-0.912523454608835,True,falls neatly into the category of good stupid fun . ,falls neatly into the category of skilful stupid fun . 
349,0,24,24,24,0.5434782608695652,0.8,0.9202993729400565,False,... turns so unforgivably trite in its last 10 minutes that anyone without a fortified sweet tooth will likely go into sugar shock . ,... turns so unforgivably trite in its last 10 minutes that anyone without a arm sweet tooth will likely go into lucre shock . 
149,1,30,30,29,0.7487684729064039,0.9,0.9781783974205083,False,"the volatile dynamics of female friendship is the subject of this unhurried , low-key film that is so off-hollywood that it seems positively french in its rhythms and resonance . ","the volatile dynamics of female friendship is the subject of this unhurried , low-keystone film that is so off-hollywood that it seems positively french in its rhythms and resonance . "
548,0,22,22,22,0.47186147186147187,0.7,0.7221908730325561,False,"i 've always dreamed of attending cannes , but after seeing this film , it 's not that big a deal . ","i 've constantly dreamed of attending cannes , but subsequently seeing this film , it 's non that big a deal . "
419,0,8,8,8,0.9285714285714286,1.0,0.9983324088662352,False,i 'm just too bored to care . ,i 'chiliad just too bored to care . 
298,0,12,12,12,1.0,1.0,1.0,False,serving sara does n't serve up a whole lot of laughs . ,serving sara does n't serve up a whole lot of laughs . 
373,0,16,16,16,1.0,1.0,1.0000000000000002,False,not since freddy got fingered has a major release been so painful to sit through . ,not since freddy got fingered has a major release been so painful to sit through . 
462,0,4,4,4,1.0,1.0,1.0000000000000002,False,"yes , dull . ","yes , dull . "
513,0,31,31,31,0.7935483870967742,0.9,0.9841280190433973,False,"care deftly captures the wonder and menace of growing up , but he never really embraces the joy of fuhrman 's destructive escapism or the grace-in-rebellion found by his characters . ","care deftly captures the wonder and menace of growing up , but he never really embraces the joy of fuhrman 's destructive escapism or the grace-in-rebellion plant by his characters . "
395,1,17,17,17,0.6470588235294118,0.7,0.9866491887417866,False,another in-your-face wallow in the lower depths made by people who have never sung those blues . ,another in-your-face wallow in the lower depths made by people who have never talk those blues . 
325,1,21,21,21,0.8285714285714286,0.9,0.9976147539490394,False,"liotta put on 30 pounds for the role , and has completely transformed himself from his smooth , goodfellas image . ","liotta put on 30 pounds for the role , and has completely transformed himself from his smooth , goodfellas picture . "
814,0,23,23,23,1.0,1.0,1.0000000000000002,False,"this piece of channel 5 grade trash is , quite frankly , an insult to the intelligence of the true genre enthusiast . ","this piece of channel 5 grade trash is , quite frankly , an insult to the intelligence of the true genre enthusiast . "
782,1,31,31,31,0.5053763440860215,0.7,0.9153219666734038,False,the structure the film takes may find matt damon and ben affleck once again looking for residuals as this officially completes a good will hunting trilogy that was never planned . ,the structure the film takes may find matt damon and ben affleck erst again looking for residue as this officially completes a good will hunting trilogy that was never planned . 
272,0,9,9,9,1.0,1.0,1.0000000000000002,False,it 's like watching a nightmare made flesh . ,it 's like watching a nightmare made flesh . 
27,1,23,23,23,1.0,1.0,1.0000000000000002,False,it 's an offbeat treat that pokes fun at the democratic exercise while also examining its significance for those who take part . ,it 's an offbeat treat that pokes fun at the democratic exercise while also examining its significance for those who take part . 
