id,pred_label,orig_len,aug_len,aligned_tokens,kendall_tau,top_k_overlap,cosine_similarity,flip,text,aug_text
95,1,26,26,26,0.796923076923077,0.9,0.9880490990601639,False,this riveting world war ii moral suspense story deals with the shadow side of american culture : racial prejudice in its ugly and diverse forms . ,this riveting world warfare ii moral suspense story deals with the shadow side of american culture : racial prejudice in its vile and diverse forms . 
162,0,27,27,27,0.4700854700854701,0.8,0.4820275167982148,False,"there seems to be no clear path as to where the story 's going , or how long it 's going to take to get there . ","there seems to be nobelium clear path as to where the story 'entropy start , or how long it 's going to take to get there . "
735,1,24,24,24,0.5072463768115942,0.9,0.5918301136875997,False,the experience of going to a film festival is a rewarding one ; the experiencing of sampling one through this movie is not . ,the experience of going to a film festival is a rewarding one ; the experiencing of sampling one through this movie is non . 
733,0,28,28,28,1.0,1.0,1.0000000000000002,False,"the man from elysian fields is a cold , bliss-less work that groans along thinking itself some important comment on how life throws us some beguiling curves . ","the man from elysian fields is a cold , bliss-less work that groans along thinking itself some important comment on how life throws us some beguiling curves . "
507,1,14,14,14,1.0,1.0,1.0000000000000002,False,the minor figures surrounding ( bobby ) ... form a gritty urban mosaic . ,the minor figures surrounding ( bobby ) ... form a gritty urban mosaic . 
2,1,20,20,20,1.0,1.0,1.0,False,allows us to hope that nolan is poised to embark a major career as a commercial yet inventive filmmaker . ,allows us to hope that nolan is poised to embark a major career as a commercial yet inventive filmmaker . 
503,0,15,15,15,0.3904761904761905,0.8,0.8596552107407957,False,"dragonfly has no atmosphere , no tension -- nothing but costner , flailing away . ","dragonfly feature no ambience , no tension -- nothing but costner , flailing away . "
71,1,28,28,28,0.746031746031746,0.8,0.970162186004118,False,"exquisitely nuanced in mood tics and dialogue , this chamber drama is superbly acted by the deeply appealing veteran bouquet and the chilling but quite human berling . ","exquisitely nuanced in mood tics and dialogue , this chamber drama is superbly acted by the deeply appealing veteran bouquet and the shuddery but rather human berling . "
563,1,17,17,17,0.5588235294117647,0.8,0.9312653700619149,False,"with rabbit-proof fence , noyce has tailored an epic tale into a lean , economical movie . ","with rabbit-proof debate , noyce experience tailored an epic tale into a lean , economical movie . "
613,1,23,23,23,0.7470355731225297,0.8,0.9839995509601066,False,... takes the beauty of baseball and melds it with a story that could touch anyone regardless of their familiarity with the sport ,... takes the beauty of baseball and melds it with a story that could touch anyone regardless of their familiarity with the boast 
766,1,27,27,27,0.8176638176638177,0.9,0.9917390047027659,False,"while its careful pace and seemingly opaque story may not satisfy every moviegoer 's appetite , the film 's final scene is soaringly , transparently moving . ","while its careful pace and seemingly opaque story may not satisfy every moviegoer 'south appetite , the film 'southward final scene is soaringly , transparently moving . "
534,1,9,9,9,1.0,1.0,1.0,False,i just loved every minute of this film . ,i just loved every minute of this film . 
227,1,19,19,19,1.0,1.0,1.0,False,"as the two leads , lathan and diggs are charming and have chemistry both as friends and lovers . ","as the two leads , lathan and diggs are charming and have chemistry both as friends and lovers . "
585,0,18,18,18,0.5555555555555556,0.8,0.9211873299298087,False,"one of those pictures whose promising , if rather precious , premise is undercut by amateurish execution . ","one of those pictures whose promising , if rather precious , premise is undercut by inexpert execution . "
623,1,13,13,13,1.0,1.0,1.0,False,"it is amusing , and that 's all it needs to be . ","it is amusing , and that 's all it needs to be . "
326,1,12,12,12,1.0,1.0,1.0000000000000002,False,a beguiling splash of pastel colors and prankish comedy from disney . ,a beguiling splash of pastel colors and prankish comedy from disney . 
569,1,16,16,16,0.7666666666666667,0.9,0.9846269065483281,False,"one of those energetic surprises , an original that pleases almost everyone who sees it . ","I of those energetic surprises , an original that pleases almost everyone who visit it . "
637,0,11,11,10,0.7777777777777778,1.0,0.9799318262967976,False,the piquant story needs more dramatic meat on its bones . ,the piquant report needs more dramatic essence on IT bones . 
115,1,16,16,16,0.48333333333333334,0.7,0.806448991174818,False,sam mendes has become valedictorian at the school for soft landings and easy ways out . ,sam mendes has become valedictorian at the school for soft landing and easy manner out . 
185,1,17,17,16,0.65,0.8,0.9150048896084182,False,"a must-see for the david mamet enthusiast and for anyone who appreciates intelligent , stylish moviemaking . ","a mustiness-see for the david mamet enthusiast and for anyone who appreciates intelligent , stylish moviemaking . "
685,0,16,16,16,1.0,1.0,1.0,False,no screen fantasy-adventure in recent memory has the showmanship of clones ' last 45 minutes . ,no screen fantasy-adventure in recent memory has the showmanship of clones ' last 45 minutes . 
174,1,16,16,16,0.6666666666666666,0.9,0.9840108366023417,False,if you dig on david mamet 's mind tricks ... rent this movie and enjoy ! ,if you drudge on david mamet 's idea tricks ... rent this movie and enjoy ! 
641,1,19,19,19,0.695906432748538,0.9,0.9895738635086002,False,the magic of the film lies not in the mysterious spring but in the richness of its performances . ,the magic of the pic lies not in the mysterious spring but in the richness of its performances . 
356,1,26,26,26,0.7723076923076924,0.9,0.9822171312057774,False,"jason x is positively anti-darwinian : nine sequels and 400 years later , the teens are none the wiser and jason still kills on auto-pilot . ","jason decade is positively anti-darwinian : nine sequels and 400 years later , the teens are none the wiser and jason still kills on auto-pilot . "
340,0,24,24,24,1.0,1.0,0.9999999999999999,False,"the most hopelessly monotonous film of the year , noteworthy only for the gimmick of being filmed as a single unbroken 87-minute take . ","the most hopelessly monotonous film of the year , noteworthy only for the gimmick of being filmed as a single unbroken 87-minute take . "
354,1,9,9,9,1.0,1.0,1.0,False,"the film is quiet , threatening and unforgettable . ","the film is quiet , threatening and unforgettable . "
611,1,10,10,10,0.6,1.0,0.9391086233398551,False,the performances take the movie to a higher level . ,the performances take the film to a higher layer . 
313,1,13,13,13,1.0,1.0,0.9999999999999999,False,the best film about baseball to hit theaters since field of dreams . ,the best film about baseball to hit theaters since field of dreams . 
251,0,16,16,16,1.0,1.0,1.0000000000000002,False,the film tries too hard to be funny and tries too hard to be hip . ,the film tries too hard to be funny and tries too hard to be hip . 
105,0,32,32,32,0.5564516129032258,0.7,0.4536552304427365,False,"combining quick-cut editing and a blaring heavy metal much of the time , beck seems to be under the illusion that he 's shooting the latest system of a down video . ","combining quick-cut editing and a blaring heavy metal much of the time , beck seems to be under the illusion that he 's shooting the latest system of a depressed video . "
172,1,23,23,23,1.0,1.0,1.0,False,it seems like i have been waiting my whole life for this movie and now i ca n't wait for the sequel . ,it seems like i have been waiting my whole life for this movie and now i ca n't wait for the sequel . 
67,1,9,9,9,1.0,1.0,1.0000000000000002,False,"a fast , funny , highly enjoyable movie . ","a fast , funny , highly enjoyable movie . "
178,0,19,19,19,0.7543859649122807,0.8,0.9606558433525536,False,it made me want to wrench my eyes out of my head and toss them at the screen . ,it made me want to twist my eyes out of my maneuver and toss them at the screen . 
439,1,16,16,16,1.0,1.0,0.9999999999999999,False,yakusho and shimizu ... create engaging characterizations in imamura 's lively and enjoyable cultural mix . ,yakusho and shimizu ... create engaging characterizations in imamura 's lively and enjoyable cultural mix . 
383,1,12,12,12,0.696969696969697,0.8,0.9881130941386673,False,"a warm but realistic meditation on friendship , family and affection . ","a tender but realistic meditation on friendship , home and affection . "
163,0,44,44,44,0.5644820295983086,0.8,0.9418443296661234,False,"slapstick buffoonery can tickle many a preschooler 's fancy , but when it costs a family of four about $ 40 to see a film in theaters , why spend money on a dog like this when you can rent a pedigree instead ? ","slapstick buffoonery can tickle many a preschooler 's fancy , but when it costs a family of quaternity about $ 40 to see a film in theaters , why spend money on a dog like this when you can rent a pedigree instead ? "
699,0,9,9,9,1.0,1.0,0.9999999999999999,False,"... routine , harmless diversion and little else . ","... routine , harmless diversion and little else . "
37,0,27,27,27,0.3561253561253561,0.5,0.6146427188613752,False,"( w ) hile long on amiable monkeys and worthy environmentalism , jane goodall 's wild chimpanzees is short on the thrills the oversize medium demands . ","( w ) hile long on amiable scalawag and worthy environmentalism , jane goodall 's wild chimpanzees is short on the exhilarate the oversize spiritualist demands . "
692,1,24,24,24,0.5217391304347826,0.6,0.9413968646566292,False,"sustains its dreamlike glide through a succession of cheesy coincidences and voluptuous cheap effects , not the least of which is rebecca romijn-stamos . ","sustains its dreamlike glide done a succession of cheesy concurrence and epicurean cheap effects , non the least of which is rebecca romijn-stamos . "
532,1,22,22,21,0.4666666666666667,0.7,-0.7636884914266108,True,"for anyone unfamiliar with pentacostal practices in general and theatrical phenomenon of hell houses in particular , it 's an eye-opener . ","for anyone unfamiliar with pentacostal practices in general and theatrical phenomenon of hell houses in particular , it 's an eye-undoer . "
802,0,14,14,14,0.2967032967032967,0.7,-0.3349859492321637,False,this nickleby thing might have more homosexual undertones than an eddie murphy film . ,this nickleby thing power have more homosexual undertones than an eddie spud film . 
247,0,33,33,33,0.6931818181818182,0.8,0.9428951695512181,False,"stealing harvard is evidence that the farrelly bros. -- peter and bobby -- and their brand of screen comedy are wheezing to an end , along with green 's half-hearted movie career . ","stealing harvard is evidence that the farrelly bros. -- peter and bobby -- and their brand of screen comedy are wheezing to an end , along with green 's half-hearted pic career . "
837,1,10,10,10,0.5555555555555556,1.0,0.6472325914890569,False,will amuse and provoke adventurous adults in specialty venues . ,will disport and provoke adventurous adults in specialty venues . 
167,0,10,10,10,1.0,1.0,0.9999999999999999,False,the end result is a film that 's neither . ,the end result is a film that 's neither . 
604,1,22,22,22,0.5497835497835498,0.8,0.8738069127904702,False,vera 's technical prowess ends up selling his film short ; he smoothes over hard truths even as he uncovers them . ,vera 's technical artistry ends up selling his film short ; he smoothes over hard truths even as he uncovers them . 
852,0,5,5,5,1.0,1.0,0.9999999999999999,False,part low rent godfather . ,part low rent godfather . 
751,0,6,6,6,1.0,1.0,0.9999999999999999,False,one long string of cliches . ,one long string of cliches . 
502,0,14,14,13,0.9487179487179487,1.0,0.9949259921686032,False,"deadeningly dull , mired in convoluted melodrama , nonsensical jargon and stiff-upper-lip laboriousness . ","deadeningly dull , mired in convoluted melodrama , nonsensical jargon and stiff-upper-sassing laboriousness . "
518,1,11,11,11,0.6,1.0,0.9237500255790498,False,michael gerbosi 's script is economically packed with telling scenes . ,michael gerbosi 's script is economically packed with telling conniption . 
384,0,40,40,40,0.5435897435897435,0.8,0.9537090252959848,False,"at times , the suspense is palpable , but by the end there 's a sense that the crux of the mystery hinges on a technicality that strains credulity and leaves the viewer haunted by the waste of potential . ","at sentence , the suspense is palpable , but by the end there 's a sentience that the crux of the mystery hinges on a technicality that strains credulity and leaves the viewer haunted by the waste of potential . "
682,0,20,20,20,0.7052631578947368,0.8,0.9866179506562828,False,"in the end , the movie collapses on its shaky foundation despite the best efforts of director joe carnahan . ","in the death , the movie collapses on its shaky institution despite the best efforts of director joe carnahan . "
253,0,28,28,28,0.8624338624338624,0.9,0.9915392668297559,False,"if you believe any of this , i can make you a real deal on leftover enron stock that will double in value a week from friday . ","if you believe whatever of this , i can make you a real deal on leftover enron stock that will double in value a week from friday . "
748,0,17,17,17,0.8382352941176471,0.9,0.98801957192525,False,"and when you 're talking about a slapstick comedy , that 's a pretty big problem . ","and when you 're talking roughly a slapstick comedy , that 's a pretty big problem . "
166,0,30,30,30,0.5632183908045977,0.8,0.9228894738763798,False,"characters still need to function according to some set of believable and comprehensible impulses , no matter how many drugs they do or how much artistic license avary employs . ","characters still need to function concord to some set of believable and comprehensible impulses , no matter how many drugs they do or how often artistic license avary employs . "
575,0,34,34,34,0.37254901960784315,0.7,0.7799496732541806,False,"( director ) o'fallon manages to put some lovely pictures up on the big screen , but his skill at telling a story -- he also contributed to the screenplay -- falls short . ","( director ) o'fallon manages to put some lovely film up on the big screen , but his skill at telling a story -- he likewise contributed to the screenplay -- dip short . "
848,1,10,10,10,-0.022222222222222223,1.0,0.6356280499955342,False,his healthy sense of satire is light and fun ... ,his healthy sense of satire is light and merriment ... 
449,1,4,4,3,0.3333333333333333,1.0,0.9259022866063836,False,oh come on . ,Ohio come on . 
417,1,24,24,24,0.9565217391304348,1.0,0.9994183742596968,False,"uses sharp humor and insight into human nature to examine class conflict , adolescent yearning , the roots of friendship and sexual identity . ","uses sharp humor and insight into human nature to prove class conflict , adolescent yearning , the roots of friendship and sexual identity . "
494,1,29,29,29,0.35467980295566504,0.6,-0.6091371203502409,True,"it showcases carvey 's talent for voices , but not nearly enough and not without taxing every drop of one 's patience to get to the good stuff . ","it showcases carvey 'entropy talent for voices , but not nearly decent and not without taxing every expend of one 's patience to get to the good stuff . "
58,0,9,9,9,1.0,1.0,1.0,False,manages to be both repulsively sadistic and mundane . ,manages to be both repulsively sadistic and mundane . 
294,1,37,37,36,0.4444444444444444,0.7,0.7631056104260064,False,"the old-world - meets-new mesh is incarnated in the movie 's soundtrack , a joyful effusion of disco bollywood that , by the end of monsoon wedding , sent my spirit soaring out of the theater . ","the old-world - suffer-new operate is incarnated in the movie 'entropy soundtrack , a joyful effusion of disco bollywood that , by the end of monsoon nuptials , transmit my spirit soaring kayoed of the theater . "
53,1,14,14,14,1.0,1.0,0.9999999999999999,False,sade is an engaging look at the controversial eponymous and fiercely atheistic hero . ,sade is an engaging look at the controversial eponymous and fiercely atheistic hero . 
264,0,18,18,17,0.5441176470588235,0.8,0.7203953437014774,False,"it ca n't decide if it wants to be a mystery/thriller , a romance or a comedy . ","it ca n'thyroxine decide if it wants to be a mystery/thriller , a romance or a comedy . "
674,1,15,15,15,0.6952380952380952,1.0,0.9477158102669418,False,atom egoyan has conjured up a multilayered work that tackles any number of fascinating issues ,atom egoyan has conjured up a multilayered work that rigging any number of fascinating issues 
296,0,29,29,29,1.0,1.0,1.0,False,its well of thorn and vinegar ( and simple humanity ) has long been plundered by similar works featuring the insight and punch this picture so conspicuously lacks . ,its well of thorn and vinegar ( and simple humanity ) has long been plundered by similar works featuring the insight and punch this picture so conspicuously lacks . 
35,0,11,11,11,1.0,1.0,1.0,False,a sequence of ridiculous shoot - 'em - up scenes . ,a sequence of ridiculous shoot - 'em - up scenes . 
429,0,20,20,20,0.43157894736842106,0.7,0.9227082350632284,False,"the film 's hackneyed message is not helped by the thin characterizations , nonexistent plot and pretentious visual style . ","the flick 's commonplace message is not helped by the thin characterizations , nonexistent patch and pretentious visual dash . "
254,0,19,19,19,1.0,1.0,1.0000000000000002,False,attempts by this ensemble film to impart a message are so heavy-handed that they instead pummel the audience . ,attempts by this ensemble film to impart a message are so heavy-handed that they instead pummel the audience . 
755,1,16,16,16,0.7333333333333333,0.9,0.9921985607634908,False,"... a fun little timewaster , helped especially by the cool presence of jean reno . ","... a fun little timewaster , helped specially by the cool presence of jean reno . "
403,0,7,7,7,1.0,1.0,1.0000000000000002,False,as vulgar as it is banal . ,as vulgar as it is banal . 
845,0,22,22,21,0.8761904761904762,0.9,0.9887123604394014,False,"despite the evocative aesthetics evincing the hollow state of modern love life , the film never percolates beyond a monotonous whine . ","despite the evocative aesthetics evincing the hollow express of New love life , the film never percolates beyond a monotone whine . "
346,0,8,8,8,0.42857142857142855,1.0,0.9271241666942875,False,"not only unfunny , but downright repellent . ","non lone unfunny , but rank repellent . "
660,1,32,32,32,0.4798387096774194,0.7,0.7641400932896368,False,"like mike is a winner for kids , and no doubt a winner for lil bow wow , who can now add movies to the list of things he does well . ","like mike is a winner for kids , and nobelium doubt a achiever for lil bow wow , who can now add movies to the list of things he does well . "
838,0,18,18,18,0.5686274509803921,0.8,0.8372101109256354,False,sometimes seems less like storytelling than something the otherwise compelling director needed to get off his chest . ,sometimes seems less like storytelling than something the otherwise compelling director postulate to get off his chest . 
813,0,26,26,26,0.6369230769230769,0.8,-0.7626912766887113,True,i can take infantile humor ... but this is the sort of infantile that makes you wonder about changing the director and writer 's diapers . ,i can take infantile humor ... but this is the sort of infantile that brand you wonder about changing the director and writer 's diapers . 
865,1,18,18,18,1.0,1.0,1.0000000000000002,False,"mcconaughey 's fun to watch , the dragons are okay , not much fire in the script . ","mcconaughey 's fun to watch , the dragons are okay , not much fire in the script . "
50,0,35,35,35,0.4823529411764706,0.6,0.9174011896259432,False,"it feels like an after-school special gussied up with some fancy special effects , and watching its rote plot points connect is about as exciting as gazing at an egg timer for 93 minutes . ","it feels comparable an after-school special gussied improving with some fancy special effects , and watching its rote diagram points connect is about as exciting as gazing at an egg timekeeper for 93 minutes . "
258,0,15,15,15,0.9809523809523809,0.9,0.9987225018646074,False,`` the time machine '' is a movie that has no interest in itself . ,`` the time machine '' is a flick that has no interest in itself . 
142,0,16,16,16,0.6333333333333333,0.8,0.9001008172179944,False,what better message than ` love thyself ' could young women of any size receive ? ,what better message than ` love thyself ' could young women of any sizing receive ? 
665,1,24,24,24,1.0,1.0,1.0,False,"and if you 're not nearly moved to tears by a couple of scenes , you 've got ice water in your veins . ","and if you 're not nearly moved to tears by a couple of scenes , you 've got ice water in your veins . "
538,0,22,22,22,0.8701298701298701,1.0,0.9759069730724353,False,"it 's so mediocre , despite the dynamic duo on the marquee , that we just ca n't get no satisfaction . ","it 's so mediocre , despite the dynamic duo on the marquee , that we just calcium n't get no satisfaction . "
701,0,34,34,33,0.6325757575757576,0.8,0.8276744958300583,False,"even the finest chef ca n't make a hotdog into anything more than a hotdog , and robert de niro ca n't make this movie anything more than a trashy cop buddy comedy . ","even the finest chef ca n't make a hotdog into anything more than a hotdog , and robert Delaware niro ca n't make this movie anything more than a trashy cop buddy funniness . "
28,0,10,10,9,0.8888888888888888,1.0,0.9875913386483762,False,"it 's a cookie-cutter movie , a cut-and-paste job . ","it 's a cookie-cutter movie , a burn-and-paste job . "
217,0,31,31,31,0.5182795698924731,0.8,0.7270373653173564,False,"once ( kim ) begins to overplay the shock tactics and bait-and-tackle metaphors , you may decide it 's too high a price to pay for a shimmering picture postcard . ","once ( kim ) begins to ham the shock tactics and bait-and-tackle metaphors , you may decide it 's too high a price to pay for a shimmer picture postcard . "
374,0,24,24,24,0.6884057971014492,0.9,0.9802648626251039,False,"the movie is what happens when you blow up small potatoes to 10 times their natural size , and it ai n't pretty . ","the movie is what happens when you blow up lowly potatoes to 10 times their natural size , and it ai n't pretty . "
157,0,17,17,17,1.0,1.0,1.0,False,it takes talent to make a lifeless movie about the most heinous man who ever lived . ,it takes talent to make a lifeless movie about the most heinous man who ever lived . 
860,1,41,41,41,0.8146341463414634,0.9,0.9941176570572892,False,"stephen rea , aidan quinn , and alan bates play desmond 's legal eagles , and when joined by brosnan , the sight of this grandiloquent quartet lolling in pretty irish settings is a pleasant enough thing , ` tis . ","stephen rea , aidan quinn , and alan bates play desmond 'sec legal eagles , and when joined by brosnan , the sight of this grandiloquent quartet lolling in pretty irish settings is a pleasant enough thing , ` tis . "
615,0,28,28,25,0.5333333333333333,0.7,0.976101499774106,False,"as the latest bid in the tv-to-movie franchise game , i spy makes its big-screen entry with little of the nervy originality of its groundbreaking small-screen progenitor . ","as the latest bid in the video-to-movie franchise game , i spy makes its boastfully-screen entry with little of the nervy originality of its innovative low-screen progenitor . "
436,0,9,9,9,1.0,1.0,1.0,False,"trite , banal , cliched , mostly inoffensive . ","trite , banal , cliched , mostly inoffensive . "
780,1,11,11,11,1.0,1.0,0.9999999999999998,False,a grimly competent and stolid and earnest military courtroom drama . ,a grimly competent and stolid and earnest military courtroom drama . 
595,0,26,26,25,0.5266666666666666,0.7,0.7492070311545282,False,"all the amped-up tony hawk-style stunts and thrashing rap-metal ca n't disguise the fact that , really , we 've been here , done that . ","totally the amped-up tony hawk-style stunts and thrashing knap-metal ca n't disguise the fact that , really , we 've been here , done that . "
488,1,30,30,30,0.8804597701149425,1.0,0.9969505127260886,False,"a cartoon that 's truly cinematic in scope , and a story that 's compelling and heartfelt -- even if the heart belongs to a big , four-legged herbivore . ","a cartoon that 's truly cinematic in scope , and a story that 's compelling and heartfelt -- even if the heart go to a big , four-legged herbivore . "
315,0,10,10,10,0.7777777777777778,1.0,0.9603001635539751,False,"complete lack of originality , cleverness or even visible effort ","terminated lack of originality , cleverness or even visible effort "
698,1,36,36,36,1.0,1.0,1.0000000000000002,False,"an interesting story with a pertinent ( cinematically unique ) message , told fairly well and scored to perfection , i found myself struggling to put my finger on that elusive `` missing thing . '' ","an interesting story with a pertinent ( cinematically unique ) message , told fairly well and scored to perfection , i found myself struggling to put my finger on that elusive `` missing thing . '' "
