id,pred_label,orig_len,aug_len,aligned_tokens,kendall_tau,top_k_overlap,cosine_similarity,text,aug_text
276,1,28,28,28,0.8148148148148148,0.9,0.9677201756168553,"for this reason and this reason only -- the power of its own steadfast , hoity-toity convictions -- chelsea walls deserves a medal . ","for this rationality and this reason only -- the power of its own steadfast , hoity-toity convictions -- chelsea walls deserves a medal . "
655,1,14,14,14,0.6483516483516484,0.9,0.901609850330017,"birthday girl is an amusing joy ride , with some surprisingly violent moments . ","birthday daughter is an amusing joy ride , with some surprisingly fierce moments . "
704,0,18,18,18,1.0,1.0,1.0,a bloated gasbag thesis grotesquely impressed by its own gargantuan aura of self-importance ... ,a bloated gasbag thesis grotesquely impressed by its own gargantuan aura of self-importance ... 
570,1,27,27,27,0.8803418803418803,0.9,0.9953992067520047,"seldahl 's barbara is a precise and moving portrait of someone whose world is turned upside down , first by passion and then by illness . ","seldahl 's barbara is a precise and moving portrait of someone whose world is release upside down , start by passion and then by illness . "
224,1,31,31,31,0.8279569892473119,0.7,0.991652503654676,"nothing 's at stake , just a twisty double-cross you can smell a mile away -- still , the derivative nine queens is lots of fun . ","nothing 's at stake , just a twisty double-cross you can aroma a mile away -- still , the derivative nine king is lots of fun . "
701,0,38,38,38,0.8321479374110953,0.9,0.9822361560731792,"even the finest chef ca n't make a hotdog into anything more than a hotdog , and robert de niro ca n't make this movie anything more than a trashy cop buddy comedy . ","even the finest chef calcium n't make a hotdog into anything more than a wienerwurst , and robert de niro ca north't make this movie anything more than a trashy cop buddy comedy . "
332,1,19,19,19,1.0,1.0,1.0,broomfield turns his distinctive ` blundering ' style into something that could really help clear up the case . ,broomfield turns his distinctive ` blundering ' style into something that could really help clear up the case . 
57,0,12,12,12,1.0,1.0,1.0000000000000002,the cold turkey would 've been a far better title . ,the cold turkey would 've been a far better title . 
234,1,8,8,8,1.0,1.0,0.9999999999999999,affleck and jackson are good sparring partners . ,affleck and jackson are good sparring partners . 
855,1,15,15,15,0.8476190476190476,0.9,0.9712843866439506,it 's fascinating to see how bettany and mcdowell play off each other . ,it 'second fascinating to see how bettany and mcdowell play off each other . 
323,0,8,8,8,1.0,1.0,1.0,a painfully funny ode to bad behavior . ,a painfully funny ode to bad behavior . 
410,1,27,27,27,1.0,1.0,1.0,what distinguishes time of favor from countless other thrillers is its underlying concern with the consequences of words and with the complicated emotions fueling terrorist acts . ,what distinguishes time of favor from countless other thrillers is its underlying concern with the consequences of words and with the complicated emotions fueling terrorist acts . 
67,1,9,9,9,1.0,1.0,1.0000000000000002,"a fast , funny , highly enjoyable movie . ","a fast , funny , highly enjoyable movie . "
216,1,28,28,28,0.6772486772486772,0.8,0.717987158160308,the movie understands like few others how the depth and breadth of emotional intimacy give the physical act all of its meaning and most of its pleasure . ,the movie sympathise like few others how the depth and breadth of emotional intimacy give the physical act all of its meaning and most of its pleasure . 
580,0,27,27,27,0.6923076923076923,0.7,0.8467529152763917,"it takes a certain kind of horror movie to qualify as ` worse than expected , ' but ghost ship somehow manages to do exactly that . ","it takes a certain kind of horror movie to restrict as ` worse than expected , ' but ghost ship somehow supervise to coiffe exactly that . "
735,1,24,24,24,1.0,1.0,1.0,the experience of going to a film festival is a rewarding one ; the experiencing of sampling one through this movie is not . ,the experience of going to a film festival is a rewarding one ; the experiencing of sampling one through this movie is not . 
322,0,7,7,7,0.8095238095238095,1.0,0.9331802556856922,that 's pure pr hype . ,that 'entropy pure pr hype . 
217,0,36,36,36,0.8984126984126984,0.8,0.9682747890116408,"once ( kim ) begins to overplay the shock tactics and bait-and-tackle metaphors , you may decide it 's too high a price to pay for a shimmering picture postcard . ","formerly ( kim ) begins to overplay the shock tactics and bait-and-rigging metaphors , you may decide it 'sulphur too high a price to pay for a shimmering picture postcard . "
671,1,34,34,34,0.8074866310160428,0.9,0.9521922510647347,two hours fly by -- opera 's a pleasure when you do n't have to endure intermissions -- and even a novice to the form comes away exhilarated . ,two hours fly by -- opera 'sulphur a pleasure when you do n'tetraiodothyronine have to endure break -- and even a novitiate to the form comes away exhilarated . 
511,1,26,26,26,0.9138461538461539,1.0,0.9940234426985673,lapaglia 's ability to convey grief and hope works with weaver 's sensitive reactions to make this a two-actor master class . ,lapaglia 's ability to convey grief and hope works with weaver 's sensitive reactions to make this a II-actor master class . 
405,1,17,17,16,0.9666666666666667,1.0,0.9981915782112233,"outer-space buffs might love this film , but others will find its pleasures intermittent . ","outer-space buffs might love this film , but others will find IT pleasures intermittent . "
658,1,8,8,8,1.0,1.0,1.0000000000000002,"a smart , witty follow-up . ","a smart , witty follow-up . "
469,0,14,14,14,1.0,1.0,0.9999999999999999,so unremittingly awful that labeling it a dog probably constitutes cruelty to canines . ,so unremittingly awful that labeling it a dog probably constitutes cruelty to canines . 
146,1,25,25,25,1.0,1.0,1.0000000000000002,"about a manga-like heroine who fights back at her abusers , it 's energetic and satisfying if not deep and psychological . ","about a manga-like heroine who fights back at her abusers , it 's energetic and satisfying if not deep and psychological . "
271,0,7,7,7,1.0,1.0,1.0,as unseemly as its title suggests . ,as unseemly as its title suggests . 
864,0,8,8,8,1.0,1.0,0.9880446247668833,"dull , lifeless , and amateurishly assembled . ","slow , lifeless , and amateurishly assembled . "
252,1,10,10,10,1.0,1.0,1.0,blanchett 's performance confirms her power once again . ,blanchett 's performance confirms her power once again . 
847,0,34,34,34,0.9322638146167558,1.0,0.9972019361541655,"... mafia , rap stars and hood rats butt their ugly heads in a regurgitation of cinematic violence that gives brutal birth to an unlikely , but likable , hero . ' ","... mafia , rap stars and tough rats butt their ugly heads in a regurgitation of cinematic violence that gives brutal nativity to an unlikely , but likable , hero . ' "
551,0,23,23,23,1.0,1.0,1.0,nothing in waking up in reno ever inspired me to think of its inhabitants as anything more than markers in a screenplay . ,nothing in waking up in reno ever inspired me to think of its inhabitants as anything more than markers in a screenplay . 
269,0,22,22,22,0.7316017316017316,0.9,0.761086843436853,"with virtually no interesting elements for an audience to focus on , chelsea walls is a triple-espresso endurance challenge . ","with virtually no worry elements for an audience to focus on , chelsea walls is a triple-espresso survival challenge . "
598,0,24,24,24,0.9347826086956522,1.0,0.9317405998727846,"nonsensical , dull `` cyber-horror '' flick is a grim , hollow exercise in flat scares and bad acting . ","preposterous , dull `` cyber-horror '' flick is a grim , hollow exercise in flat scares and bad acting . "
438,1,49,49,49,0.8333333333333334,0.9,0.9960429494386446,"the movie has an infectious exuberance that will engage anyone with a passing interest in the skate/surf culture , the l.a. beach scene and the imaginative ( and sometimes illegal ) ways kids can make a playground out of the refuse of adults . ","the movie has an infectious exuberance that will engage anyone with a fugacious interest in the skate/surf culture , the l.a. beach scene and the imaginative ( and sometimes illegal ) ways kids can make a playground kayoed of the refuse of adults . "
597,0,28,28,28,0.7936507936507936,0.9,0.9920479234249002,"visually rather stunning , but ultimately a handsome-looking bore , the true creativity would have been to hide treasure planet entirely and completely reimagine it . ","visually rather stunning , but ultimately a handsome-reckon bore , the true creativity would have been to fell treasure planet entirely and totally reimagine it . "
408,0,29,29,29,0.6206896551724138,0.9,0.9413318417424996,"there are simply too many ideas floating around -- part farce , part sliding doors , part pop video -- and yet failing to exploit them . ","thither are simply also many ideas floating around -- part farce , office sliding doors , break pop video -- and yet failing to exploit them . "
804,0,44,44,44,1.0,1.0,1.0,"but the power of these ( subjects ) is obscured by the majority of the film that shows a stationary camera on a subject that could be mistaken for giving a public oration , rather than contributing to a film 's narrative . ","but the power of these ( subjects ) is obscured by the majority of the film that shows a stationary camera on a subject that could be mistaken for giving a public oration , rather than contributing to a film 's narrative . "
763,1,42,42,42,0.8141695702671312,1.0,0.9823959782749829,"there 's something auspicious , and daring , too , about the artistic instinct that pushes a majority-oriented director like steven spielberg to follow a.i. with this challenging report so liable to unnerve the majority . ","there 's something auspicious , and daring , too , about the artistic instinct that pushes a bulk-oriented director like steven spielberg to follow a.i. with this challenging report so liable to unnerve the majority . "
521,0,20,20,20,0.8526315789473684,0.9,0.9816264406713612,"comes off like a rejected abc afterschool special , freshened up by the dunce of a screenwriting 101 class . ","comes off like a disapprove abc afterschool special , freshened up by the dunce of a screenwriting 101 class . "
505,1,15,15,15,1.0,1.0,0.9999999999999999,and that 's a big part of why we go to the movies . ,and that 's a big part of why we go to the movies . 
93,0,17,17,17,1.0,1.0,1.0000000000000002,if steven soderbergh 's ` solaris ' is a failure it is a glorious failure . ,if steven soderbergh 's ` solaris ' is a failure it is a glorious failure . 
48,1,12,12,12,0.8484848484848485,1.0,0.8709481010123596,has a lot of the virtues of eastwood at his best . ,has a stack of the virtues of eastwood at his best . 
112,0,5,5,5,1.0,1.0,1.0,hilariously inept and ridiculous . ,hilariously inept and ridiculous . 
156,1,17,17,17,0.7941176470588235,0.9,0.7461774304230976,"manages to transcend the sex , drugs and show-tunes plot into something far richer . ","superintend to transcend the sex , drugs and show-tunes plot into something far richer . "
642,0,29,29,29,0.916256157635468,1.0,0.9465410975314278,"this re-do is so dumb and so exploitative in its violence that , ironically , it becomes everything that the rather clumsy original was railing against . ","this re-do is so dumb and so exploitative in its violence that , ironically , it becomes everything that the kinda clumsy original was railing against . "
832,0,17,17,17,0.7794117647058824,0.9,0.9942506430631489,manages to show life in all of its banality when the intention is quite the opposite . ,manages to show biography in all of its bromide when the intention is rather the opposite . 
696,1,30,30,30,0.8298850574712644,1.0,0.9905474191835926,"for the first time in years , de niro digs deep emotionally , perhaps because he 's been stirred by the powerful work of his co-stars . ","for the first clock in years , de niro digs deep emotionally , peradventure because he 's been stirred by the powerful work of his co-stars . "
830,1,28,28,28,1.0,1.0,1.0,"woody allen 's latest is an ambling , broad comedy about all there is to love -- and hate -- about the movie biz . ","woody allen 's latest is an ambling , broad comedy about all there is to love -- and hate -- about the movie biz . "
610,0,14,14,14,0.7142857142857143,0.9,0.9654867622465413,like you could n't smell this turkey rotting from miles away . ,like you could n't odor this turkey rotting from mil outside . 
65,0,20,20,20,1.0,1.0,0.9999999999999998,you wonder why enough was n't just a music video rather than a full-length movie . ,you wonder why enough was n't just a music video rather than a full-length movie . 
394,1,44,44,44,0.8054968287526427,1.0,0.9972998557389268,"whether writer-director anne fontaine 's film is a ghost story , an account of a nervous breakdown , a trip down memory lane , all three or none of the above , it is as seductive as it is haunting . ","whether writer-director anne fontaine 's film is a ghost story , an account of a nervous dislocation , a trip down memory lane , all three or none of the above , it is as seductive as it is haunting . "
390,0,16,16,16,0.9,1.0,0.9276275809439878,"mattei is tiresomely grave and long-winded , as if circularity itself indicated profundity . ","mattei is tiresomely solemn and long-winded , as if circularity itself indicated profundity . "
719,1,15,15,15,0.9047619047619048,0.9,0.995750059069102,"whaley 's determination to immerse you in sheer , unrelenting wretchedness is exhausting . ","whaley 's determination to immerse you in sheer , unrelenting wretchedness is release . "
479,1,13,13,13,1.0,1.0,1.0000000000000002,it 's a stunning lyrical work of considerable force and truth . ,it 's a stunning lyrical work of considerable force and truth . 
541,1,9,9,9,1.0,1.0,1.0,the most compelling wiseman epic of recent years . ,the most compelling wiseman epic of recent years . 
257,0,19,19,19,0.8128654970760234,0.9,0.8876055754413908,taylor appears to have blown his entire budget on soundtrack rights and had nothing left over for jokes . ,taylor appears to possess blown his entire budget on soundtrack rights and birth nothing left over for jokes . 
566,0,21,21,21,1.0,1.0,0.9999999999999998,does little more than play an innocuous game of fill-in - the-blanks with a tragic past . ,does little more than play an innocuous game of fill-in - the-blanks with a tragic past . 
11,0,30,30,30,1.0,1.0,1.0,"it takes a strange kind of laziness to waste the talents of robert forster , anne meara , eugene levy , and reginald veljohnson all in the same movie . ","it takes a strange kind of laziness to waste the talents of robert forster , anne meara , eugene levy , and reginald veljohnson all in the same movie . "
801,0,13,13,13,1.0,1.0,1.0,"this film seems thirsty for reflection , itself taking on adolescent qualities . ","this film seems thirsty for reflection , itself taking on adolescent qualities . "
117,1,26,26,26,0.803076923076923,0.8,0.9850841609717854,"moody , heartbreaking , and filmed in a natural , unforced style that makes its characters seem entirely convincing even when its script is not . ","moody , heartbreaking , and filmed in a natural , unforced way that makes its characters seem entirely convincing even when its script is not . "
698,1,38,38,38,0.8236130867709816,0.9,0.9081691624969487,"an interesting story with a pertinent ( cinematically unique ) message , told fairly well and scored to perfection , i found myself struggling to put my finger on that elusive `` missing thing . '' ","an interesting history with a pertinent ( cinematically unique ) message , told fairly well and scored to perfection , i found myself struggling to put my finger on that elusive `` wanting thing . '' "
812,1,14,14,14,0.6923076923076923,0.8,0.9564812539544117,this surreal gilliam-esque film is also a troubling interpretation of ecclesiastes . ,this surreal gilliam-esque film is also a troubling version of ecclesiastes . 
833,0,15,15,15,0.8666666666666667,0.9,0.9986509630899848,"ultimately feels empty and unsatisfying , like swallowing a communion wafer without the wine . ","ultimately feels empty and unsatisfying , like swallowing a sharing wafer without the wine . "
656,0,13,13,13,1.0,1.0,1.0000000000000002,"so much facile technique , such cute ideas , so little movie . ","so much facile technique , such cute ideas , so little movie . "
829,0,8,8,8,1.0,1.0,1.0000000000000002,teen movies have really hit the skids . ,teen movies have really hit the skids . 
870,0,13,13,13,1.0,1.0,1.0,... is an arthritic attempt at directing by callie khouri . ,... is an arthritic attempt at directing by callie khouri . 
807,1,10,10,10,0.6444444444444445,1.0,0.885192200106468,"just as moving , uplifting and funny as ever . ","barely as moving , uplifting and funny as always . "
445,1,12,12,12,1.0,1.0,1.0,"even in its most tedious scenes , russian ark is mesmerizing . ","even in its most tedious scenes , russian ark is mesmerizing . "
161,0,5,5,5,0.4,1.0,0.813291797199643,not exactly the bees knees ,non exactly the bees knees 
789,0,42,42,41,0.7439024390243902,0.9,0.9005921287502575,"it 's as if you 're watching a movie that was made in 1978 but not released then because it was so weak , and it has been unearthed and released now , when it has become even weaker . ","it 's as if you 'Ra watching a movie that was made in 1978 but not released so because it was so rickety , and it has been unearthed and released now , when it has become even weaker . "
737,1,20,20,20,1.0,1.0,1.0,my big fat greek wedding uses stereotypes in a delightful blend of sweet romance and lovingly dished out humor . ,my big fat greek wedding uses stereotypes in a delightful blend of sweet romance and lovingly dished out humor . 
512,0,26,26,26,0.8646153846153846,1.0,0.9375214756092229,villeneuve spends too much time wallowing in bibi 's generic angst ( there are a lot of shots of her gazing out windows ) . ,villeneuve spends too much time wallowing in bibi 's generic angst ( there are a batch of shots of her gaze out windows ) . 
182,1,27,27,27,0.8632478632478633,0.9,0.9676242546385864,"i sympathize with the plight of these families , but the movie does n't do a very good job conveying the issue at hand . ","ane sympathize with the plight of these families , but the movie does n't do a very good job conveying the issue at hand . "
519,0,16,16,16,1.0,1.0,0.9999999999999999,moretti 's compelling anatomy of grief and the difficult process of adapting to loss . ,moretti 's compelling anatomy of grief and the difficult process of adapting to loss . 
108,0,22,22,22,0.8528138528138528,1.0,0.9967269664048106,"too often , the viewer is n't reacting to humor so much as they are wincing back in repugnance . ","too often , the viewer is n't reacting to wittiness so much as they are wincing back in repugnance . "
640,1,22,22,22,0.7835497835497836,0.9,0.8840999617886834,"an important movie , a reminder of the power of film to move us and to make us examine our values . ","an important movie , a monitor of the power of film to move us and to make us examine our values . "
305,0,17,17,17,1.0,1.0,1.0000000000000002,what was once original has been co-opted so frequently that it now seems pedestrian . ,what was once original has been co-opted so frequently that it now seems pedestrian . 
871,1,26,26,26,0.8584615384615385,0.9,0.9914910992241044,"looking aristocratic , luminous yet careworn in jane hamilton 's exemplary costumes , rampling gives a performance that could not be improved upon . ' ","sounding aristocratic , luminous yet careworn in jane hamilton 's exemplary costumes , rampling gives a performance that could not be improved upon . ' "
693,0,20,20,19,0.9766081871345029,1.0,0.9995428693358634,"because of an unnecessary and clumsy last scene , ` swimfan ' left me with a very bad feeling . ","because of an unnecessary and clumsy last scene , ` swimfan ' left Maine with a very bad feeling . "
776,0,27,27,27,0.8689458689458689,0.9,0.9854830947280561,"as ` chick flicks ' go , this one is pretty miserable , resorting to string-pulling rather than legitimate character development and intelligent plotting . ","as ` chick flicks ' go , this single is pretty miserable , resorting to string-overstretch rather than legitimate character development and intelligent plotting . "
846,0,10,10,10,1.0,1.0,0.9999999999999998,"an absurdist comedy about alienation , separation and loss . ","an absurdist comedy about alienation , separation and loss . "
724,1,15,15,15,1.0,1.0,0.9999999999999998,it 's everything you do n't go to the movies for . ,it 's everything you do n't go to the movies for . 
382,1,17,17,17,0.75,0.9,0.9556002888833657,a great ensemble cast ca n't lift this heartfelt enterprise out of the familiar . ,a great ensemble cast calcium nitrogen'tetraiodothyronine lift this heartfelt enterprise out of the familiar . 
165,0,22,22,22,0.670995670995671,0.8,0.8317309785941794,may reawaken discussion of the kennedy assassination but this fictional film looks made for cable rather than for the big screen . ,may reawaken discussion of the kennedy assassination but this fictional film looks make for cable sooner than for the big screen . 
552,0,22,22,22,1.0,1.0,1.0,here 's yet another studio horror franchise mucking up its storyline with glitches casual fans could correct in their sleep . ,here 's yet another studio horror franchise manure up its storyline with glitches casual fans could correct in their sleep . 
543,0,30,30,30,0.8850574712643678,0.9,0.9518536375405195,"for each chuckle there are at least 10 complete misses , many coming from the amazingly lifelike tara reid , whose acting skills are comparable to a cardboard cutout . ","for apiece chuckle there are at least 10 complete misses , many coming from the amazingly lifelike tara reid , whose acting skills are comparable to a cardboard cutout . "
0,1,10,10,10,0.7777777777777778,1.0,0.9847946185036601,it 's a charming and often affecting journey . ,it 'second a charming and often affecting journey . 
613,1,25,25,25,0.86,0.9,0.984781513274548,... takes the beauty of baseball and melds it with a story that could touch anyone regardless of their familiarity with the sport ,... takes the beauty of baseball and melds it with a story that could touch anyone regardless of their liberty with the sport 
331,1,14,14,14,1.0,1.0,1.0000000000000002,the chateau cleverly probes the cross-cultural differences between gauls and yanks . ,the chateau cleverly probes the cross-cultural differences between gauls and yanks . 
500,0,12,12,12,1.0,1.0,1.0000000000000002,a sequel that 's much too big for its britches . ,a sequel that 's much too big for its britches . 
19,0,19,19,19,1.0,1.0,1.0000000000000002,"in its best moments , resembles a bad high school production of grease , without benefit of song . ","in its best moments , resembles a bad high school production of grease , without benefit of song . "
702,0,21,21,21,1.0,1.0,0.9999999999999999,"the reality of the new live-action pinocchio he directed , cowrote and starred in borders on the grotesque . ","the reality of the new live-action pinocchio he directed , cowrote and starred in borders on the grotesque . "
371,0,25,25,25,0.6066666666666667,0.8,0.879559212136297,"for the most part , it 's a work of incendiary genius , steering clear of knee-jerk reactions and quick solutions . ","for the most part , it 'second a work of incendiary genius , steering clear of knee-jerk reactions and quick solutions . "
314,1,20,20,20,1.0,1.0,1.0,it is great summer fun to watch arnold and his buddy gerald bounce off a quirky cast of characters . ,it is great summer fun to watch arnold and his buddy gerald bounce off a quirky cast of characters . 
245,0,26,26,26,0.9261538461538461,0.9,0.9982025420220534,it 's a work by an artist so in control of both his medium and his message that he can improvise like a jazzman . ,it 's a work by an artist so in control of both his medium and his message that helium can improvise like a jazzman . 
