id,pred_label,orig_len,aug_len,aligned_tokens,kendall_tau,top_k_overlap,cosine_similarity,flip,text,aug_text
399,1,18,18,18,0.673202614379085,0.9,0.9759858669052258,False,"if director michael dowse only superficially understands his characters , he does n't hold them in contempt . ","if director michael dowsing only superficially understands his role , he does n't hold them in contempt . "
2,1,20,20,20,0.7578947368421053,0.8,0.9481429122443529,False,allows us to hope that nolan is poised to embark a major career as a commercial yet inventive filmmaker . ,allows uranium to desire that nolan is poised to embark a major career as a commercial yet inventive filmmaker . 
736,1,13,13,12,0.6363636363636364,0.8,0.9683391165042197,False,american chai encourages rueful laughter at stereotypes only an indian-american would recognize . ,american chai encourages rueful laughter at stereotypes only an Amerindic-american would recognize . 
434,0,7,7,7,1.0,1.0,0.9999999999999999,False,almost gags on its own gore . ,almost gags on its own gore . 
44,0,19,19,19,0.5321637426900585,0.7,0.8471333296578542,False,"the title not only describes its main characters , but the lazy people behind the camera as well . ","the rubric not only describes its main characters , but the lazy people behind the camera as well . "
861,1,29,29,29,0.7241379310344828,0.9,0.841319216278001,False,"bennett 's naturalistic performance speaks volumes more truth than any ` reality ' show , and anybody contemplating their own drastic life changes should watch some body first . ","bennett 's realistic performance speaks book more truth than any ` world ' show , and anybody contemplating their own drastic life convert should watch some body first . "
145,1,27,27,27,0.7663817663817664,0.9,0.9841301494384608,False,the best that can be said about the work here of scottish director ritchie ... is that he obviously does n't have his heart in it . ,the best that can be said about the work here of scottish director ritchie ... is that he apparently does n't have his heart in it . 
509,1,22,22,22,0.7229437229437229,0.9,0.9564031191607852,False,a movie that successfully crushes a best selling novel into a timeframe that mandates that you avoid the godzilla sized soda . ,a picture that successfully crushes a best sell novel into a timeframe that mandates that you avoid the godzilla sized soda . 
714,1,23,23,22,0.8441558441558441,0.9,0.9935484451523772,False,( a ) n utterly charming and hilarious film that reminded me of the best of the disney comedies from the 60s . ,( a ) n utterly charming and hilarious film that reminded Maine of the best of the disney comedies from the 60s . 
455,1,29,29,29,0.8620689655172413,0.9,0.9788983738659695,False,"( chaiken 's ) talent lies in an evocative , accurate observation of a distinctive milieu and in the lively , convincing dialogue she creates for her characters . ","( chaiken 's ) talent lies in an evocative , accurate observation of a distinctive milieu and in the lively , convincing negotiation she creates for her characters . "
654,0,21,21,21,0.7428571428571429,0.8,0.9401737468639274,False,a science-fiction pastiche so lacking in originality that if you stripped away its inspirations there would be precious little left . ,a science-fiction pastiche so lacking in originality that if you stripped away its brainchild thither would be precious little left . 
797,0,33,33,33,0.9242424242424242,0.9,0.9991753177268712,False,"it 's not original , and , robbed of the element of surprise , it does n't have any huge laughs in its story of irresponsible cops who love to play pranks . ","it 's not original , and , robbed of the element of surprise , it does n't have any huge laughs in its story of irresponsible cops who love to bid pranks . "
163,0,44,44,44,1.0,1.0,1.0,False,"slapstick buffoonery can tickle many a preschooler 's fancy , but when it costs a family of four about $ 40 to see a film in theaters , why spend money on a dog like this when you can rent a pedigree instead ? ","slapstick buffoonery can tickle many a preschooler 's fancy , but when it costs a family of four about $ 40 to see a film in theaters , why spend money on a dog like this when you can rent a pedigree instead ? "
750,0,22,22,22,1.0,1.0,1.0,False,"nelson 's brutally unsentimental approach ... sucks the humanity from the film , leaving behind an horrific but weirdly unemotional spectacle . ","nelson 's brutally unsentimental approach ... sucks the humanity from the film , leaving behind an horrific but weirdly unemotional spectacle . "
423,0,16,16,16,1.0,1.0,1.0000000000000002,False,i am sorry that i was unable to get the full brunt of the comedy . ,i am sorry that i was unable to get the full brunt of the comedy . 
753,1,16,16,16,1.0,1.0,1.0,False,it 's hard to imagine alan arkin being better than he is in this performance . ,it 's hard to imagine alan arkin being better than he is in this performance . 
257,0,19,19,19,0.6023391812865497,0.8,0.8220139667492196,False,taylor appears to have blown his entire budget on soundtrack rights and had nothing left over for jokes . ,taylor appears to suffer blown his entire budget on soundtrack rights and had nothing left over for jokes . 
359,1,22,22,22,1.0,1.0,1.0,False,"displaying about equal amounts of naiveté , passion and talent , beneath clouds establishes sen as a filmmaker of considerable potential . ","displaying about equal amounts of naiveté , passion and talent , beneath clouds establishes sen as a filmmaker of considerable potential . "
801,0,13,13,13,0.1794871794871795,0.9,0.15157386511143883,False,"this film seems thirsty for reflection , itself taking on adolescent qualities . ","this film seems athirst for reflection , itself guide on adolescent qualities . "
722,0,31,31,31,0.875268817204301,0.9,0.9948772661734849,False,"too restrained to be a freak show , too mercenary and obvious to be cerebral , too dull and pretentious to be engaging ... the isle defies an easy categorization . ","too restrained to be a freak show , too mercenary and obvious to be intellectual , too dull and pretentious to be engaging ... the isle defies an easy categorization . "
645,0,23,23,22,0.26406926406926406,0.6,-0.28225296485301216,True,"the words , ` frankly , my dear , i do n't give a damn , ' have never been more appropriate . ","the words , ` honestly , my pricey , ane dress n'thyroxin afford a damn , ' have never been more appropriate . "
383,1,12,12,12,0.7575757575757576,0.9,0.854938629042758,False,"a warm but realistic meditation on friendship , family and affection . ","a quick but realistic meditation on friendship , family and affection . "
532,1,22,22,22,1.0,1.0,0.9999999999999999,False,"for anyone unfamiliar with pentacostal practices in general and theatrical phenomenon of hell houses in particular , it 's an eye-opener . ","for anyone unfamiliar with pentacostal practices in general and theatrical phenomenon of hell houses in particular , it 's an eye-opener . "
733,0,28,28,28,1.0,1.0,1.0000000000000002,False,"the man from elysian fields is a cold , bliss-less work that groans along thinking itself some important comment on how life throws us some beguiling curves . ","the man from elysian fields is a cold , bliss-less work that groans along thinking itself some important comment on how life throws us some beguiling curves . "
672,0,20,20,20,0.5473684210526316,0.7,0.889542055298469,False,"in all , this is a watchable movie that 's not quite the memorable experience it might have been . ","in all , this is a watchable movie that 's not quite the memorable have it might have been . "
140,0,14,14,14,0.5824175824175825,0.8,0.9429538662767327,False,sacrifices the value of its wealth of archival foot-age with its less-than-objective stance . ,sacrifices the evaluate of its wealth of archival foot-age with its less-than-objective stance . 
720,1,23,23,23,1.0,1.0,1.0,False,worth watching for dong jie 's performance -- and for the way it documents a culture in the throes of rapid change . ,worth watching for dong jie 's performance -- and for the way it documents a culture in the throes of rapid change . 
617,0,31,31,31,0.6516129032258065,0.8,-0.9425997888795435,True,"the so-inept - it 's - surreal dubbing ( featuring the voices of glenn close , regis philbin and breckin meyer ) brings back memories of cheesy old godzilla flicks . ","the so-inept - it 'siemens - surreal dubbing ( featuring the voices of glenn conclude , regis philbin and breckin meyer ) brings back memories of bum old godzilla flicks . "
243,0,14,14,14,0.4065934065934066,0.8,-0.751125844039182,True,the film tunes into a grief that could lead a man across centuries . ,the film tunes into a sorrow that could lead a man across centuries . 
740,1,29,29,29,0.2660098522167488,0.6,0.674016694993308,False,"jose campanella delivers a loosely autobiographical story brushed with sentimentality but brimming with gentle humor , bittersweet pathos , and lyric moments that linger like snapshots of memory . ","jose campanella delivers a loosely autobiographical story brushed with sloppiness but brimming with gentle humor , bittersweet pity , and lyric moments that linger like snapshots of memory . "
508,1,23,23,23,0.8102766798418972,0.8,0.9471206936074718,False,"a poignant and compelling story about relationships , food of love takes us on a bumpy but satisfying journey of the heart . ","a touching and compelling story about relationships , food of love takes us on a bumpy but satisfying journey of the heart . "
216,1,28,28,27,0.5270655270655271,0.7,0.6584157906834587,False,the movie understands like few others how the depth and breadth of emotional intimacy give the physical act all of its meaning and most of its pleasure . ,the movie understands like few others how the depth and breadth of emotional intimacy give the physical act all of its meaning and most of IT pleasure . 
632,0,9,9,9,1.0,1.0,0.9999999999999998,False,just embarrassment and a vague sense of shame . ,just embarrassment and a vague sense of shame . 
43,1,11,11,11,1.0,1.0,1.0000000000000002,False,holm ... embodies the character with an effortlessly regal charisma . ,holm ... embodies the character with an effortlessly regal charisma . 
594,1,30,30,30,0.9126436781609195,0.9,0.9985258941602508,False,"building slowly and subtly , the film , sporting a breezy spontaneity and realistically drawn characterizations , develops into a significant character study that is both moving and wise . ","building slowly and subtly , the film , sporting a breezy spontaneity and realistically drawn characterizations , prepare into a significant character study that is both moving and wise . "
782,1,31,31,31,0.44946236559139785,0.6,-0.935524806392828,True,the structure the film takes may find matt damon and ben affleck once again looking for residuals as this officially completes a good will hunting trilogy that was never planned . ,the structure the film takes may find matt damon and ben affleck once again looking for rest as this formally completes a good will hunting trilogy that was never planned . 
605,1,13,13,13,0.717948717948718,0.9,0.978665347999873,False,puts a human face on a land most westerners are unfamiliar with . ,puts a human face on a land most westerner are unfamiliar with . 
39,1,16,16,16,1.0,1.0,0.9999999999999998,False,"escaping the studio , piccoli is warmly affecting and so is this adroitly minimalist movie . ","escaping the studio , piccoli is warmly affecting and so is this adroitly minimalist movie . "
367,1,12,12,12,1.0,1.0,1.0,False,there has always been something likable about the marquis de sade . ,there has always been something likable about the marquis de sade . 
597,0,26,26,26,1.0,1.0,0.9999999999999999,False,"visually rather stunning , but ultimately a handsome-looking bore , the true creativity would have been to hide treasure planet entirely and completely reimagine it . ","visually rather stunning , but ultimately a handsome-looking bore , the true creativity would have been to hide treasure planet entirely and completely reimagine it . "
583,0,5,5,5,1.0,1.0,1.0000000000000002,False,it 's just filler . ,it 's just filler . 
349,0,24,24,24,0.6231884057971014,0.9,0.6609804493969802,False,... turns so unforgivably trite in its last 10 minutes that anyone without a fortified sweet tooth will likely go into sugar shock . ,... turns so unforgivably trite in its last 10 minutes that anyone without a fortified sweet tooth will likely go into sugar appall . 
186,1,19,19,19,1.0,1.0,1.0000000000000002,False,"pacino is brilliant as the sleep-deprived dormer , his increasing weariness as much existential as it is physical . ","pacino is brilliant as the sleep-deprived dormer , his increasing weariness as much existential as it is physical . "
302,1,9,9,9,0.7777777777777778,1.0,0.9531205227836078,False,the wild thornberrys movie is a jolly surprise . ,the wild thornberrys film is a merry surprise . 
197,0,10,10,10,1.0,1.0,1.0,False,"for starters , the story is just too slim . ","for starters , the story is just too slim . "
168,1,12,12,12,1.0,1.0,1.0000000000000002,False,manages to be sweet and wickedly satisfying at the same time . ,manages to be sweet and wickedly satisfying at the same time . 
848,1,10,10,10,0.37777777777777777,1.0,0.8118857771002229,False,his healthy sense of satire is light and fun ... ,his healthy sense of satire is light and play ... 
568,0,36,36,36,0.40634920634920635,0.6,0.7702838009446518,False,"it does nothing new with the old story , except to show fisticuffs in this sort of stop-go slow motion that makes the gang rumbles look like they 're being streamed over a 28k modem . ","it does nothing new with the onetime story , except to exhibit fisticuffs in this sort of stop-go boring motion that makes the gang rumbles look like they 're being streamed concluded a 28k modem . "
114,1,29,29,28,0.8677248677248677,0.9,0.9983030753266426,False,"it haunts you , you ca n't forget it , you admire its conception and are able to resolve some of the confusions you had while watching it . ","it haunts you , you California n't forget it , you admire its conception and are able to resolve some of the confusions you had while watching it . "
769,1,15,15,15,1.0,1.0,1.0000000000000002,False,an infectious cultural fable with a tasty balance of family drama and frenetic comedy . ,an infectious cultural fable with a tasty balance of family drama and frenetic comedy . 
171,1,9,9,9,1.0,1.0,1.0,False,rarely has leukemia looked so shimmering and benign . ,rarely has leukemia looked so shimmering and benign . 
70,0,27,27,26,0.2923076923076923,0.4,0.8497822978421092,False,"for all its impressive craftsmanship , and despite an overbearing series of third-act crescendos , lily chou-chou never really builds up a head of emotional steam . ","for all its telling craft , and despite an overbearing series of tertiary-act crescendos , lily chou-chou never really builds astir a point of emotional steam . "
826,1,10,10,10,1.0,1.0,0.9999999999999999,False,a quiet treasure -- a film to be savored . ,a quiet treasure -- a film to be savored . 
658,1,6,6,6,1.0,1.0,1.0,False,"a smart , witty follow-up . ","a smart , witty follow-up . "
609,1,32,32,32,0.5645161290322581,0.6,0.938341037570932,False,"nine queens is not only than a frighteningly capable debut and genre piece , but also a snapshot of a dangerous political situation on the verge of coming to a head . ","nine queens is not only than a frighteningly subject debut and genre piece , but also a snapshot of a dangerous political berth on the verge of coming to a mind . "
569,1,16,16,16,0.8333333333333334,0.9,0.9501354714110777,False,"one of those energetic surprises , an original that pleases almost everyone who sees it . ","one of those energetic surprises , an original that delight almost everyone who sees it . "
556,0,15,15,15,0.21904761904761905,0.9,0.5826164624968913,False,but it 's too long and too convoluted and it ends in a muddle . ,but it 's also long and too convoluted and it ends in a pickle . 
711,0,22,22,22,0.8961038961038961,0.9,0.999760068569122,False,overall the film feels like a low-budget tv pilot that could not find a buyer to play it on the tube . ,overall the film feel like a low-budget tv pilot that could not find a buyer to play it on the tube . 
737,1,20,20,20,0.4842105263157895,0.8,0.8153690637406279,False,my big fat greek wedding uses stereotypes in a delightful blend of sweet romance and lovingly dished out humor . ,my big fat greek wedding uses stereotypes in a delightful blend of sweet romance and fondly dished out wit . 
808,1,8,8,8,1.0,1.0,1.0000000000000002,False,enormously entertaining for moviegoers of any age . ,enormously entertaining for moviegoers of any age . 
351,1,25,25,25,0.8466666666666667,0.9,0.99725777798266,False,"( næs ) directed the stage version of elling , and gets fine performances from his two leads who originated the characters on stage . ","( næs ) address the stage version of elling , and gets fine performances from his two leads who originated the characters on stage . "
660,1,32,32,32,1.0,1.0,1.0,False,"like mike is a winner for kids , and no doubt a winner for lil bow wow , who can now add movies to the list of things he does well . ","like mike is a winner for kids , and no doubt a winner for lil bow wow , who can now add movies to the list of things he does well . "
94,1,24,24,24,1.0,1.0,1.0000000000000002,False,"byler reveals his characters in a way that intrigues and even fascinates us , and he never reduces the situation to simple melodrama . ","byler reveals his characters in a way that intrigues and even fascinates us , and he never reduces the situation to simple melodrama . "
539,0,6,6,6,0.2,1.0,0.8467530745406225,False,do not see this film . ,arrange not see this movie . 
3,1,20,20,20,0.8105263157894737,0.9,0.9987818918971939,False,"the acting , costumes , music , cinematography and sound are all astounding given the production 's austere locales . ","the acting , costumes , music , cinematography and sound are all astounding given the product 's austere locales . "
849,1,27,27,27,1.0,1.0,1.0000000000000002,False,trademark american triteness and simplicity are tossed out the window with the intelligent french drama that deftly explores the difficult relationship between a father and son . ,trademark american triteness and simplicity are tossed out the window with the intelligent french drama that deftly explores the difficult relationship between a father and son . 
318,0,21,21,21,1.0,1.0,1.0,False,hit and miss as far as the comedy goes and a big ole ' miss in the way of story . ,hit and miss as far as the comedy goes and a big ole ' miss in the way of story . 
124,1,33,33,32,0.6774193548387096,0.8,0.9331301205869693,False,"( lawrence bounces ) all over the stage , dancing , running , sweating , mopping his face and generally displaying the wacky talent that brought him fame in the first place . ","( Laurentius bounces ) all over the present , dancing , running , sweating , mopping his face and generally displaying the balmy talent that brought him fame in the first place . "
417,1,24,24,24,1.0,1.0,1.0,False,"uses sharp humor and insight into human nature to examine class conflict , adolescent yearning , the roots of friendship and sexual identity . ","uses sharp humor and insight into human nature to examine class conflict , adolescent yearning , the roots of friendship and sexual identity . "
308,1,17,17,17,1.0,1.0,1.0,False,an intriguing cinematic omnibus and round-robin that occasionally is more interesting in concept than in execution . ,an intriguing cinematic omnibus and round-robin that occasionally is more interesting in concept than in execution . 
275,1,13,13,13,0.8205128205128205,0.9,0.9700306973107337,False,"an entertaining , colorful , action-filled crime story with an intimate heart . ","an entertaining , colorful , action-filled crime story with an intimate pith . "
785,1,23,23,23,0.5573122529644269,0.7,0.8546560043220741,False,"aside from minor tinkering , this is the same movie you probably loved in 1994 , except that it looks even better . ","aside from minor tinkering , this is the same movie you probably loved in 1994 , except that it looks eventide better . "
611,1,10,10,10,0.7333333333333333,1.0,0.9653039173219629,False,the performances take the movie to a higher level . ,the performances consider the movie to a higher level . 
79,0,44,44,44,0.7610993657505285,0.9,0.9875378680212273,False,this is a train wreck of an action film -- a stupefying attempt by the filmmakers to force-feed james bond into the mindless xxx mold and throw 40 years of cinematic history down the toilet in favor of bright flashes and loud bangs . ,this is a train wreck of an action film -- a stupefying attempt by the filmmakers to force-feed james bond into the mindless thirty mold and throw 40 years of cinematic history down the toilet in favor of bright flashes and loud bangs . 
481,1,5,5,5,1.0,1.0,0.9999999999999998,False,funny but perilously slight . ,funny but perilously slight . 
534,1,9,9,9,0.7222222222222222,1.0,0.970347036644828,False,i just loved every minute of this film . ,single just loved every minute of this film . 
781,0,6,6,6,1.0,1.0,0.9999999999999999,False,at once half-baked and overheated . ,at once half-baked and overheated . 
36,1,26,26,26,0.48307692307692307,0.6,0.968118510787531,False,"the weight of the piece , the unerring professionalism of the chilly production , and the fascination embedded in the lurid topic prove recommendation enough . ","the slant of the piece , the unerring professionalism of the chilly production , and the fascination embedded in the lurid matter prove recommendation enough . "
5,1,21,21,21,1.0,1.0,1.0,False,"although laced with humor and a few fanciful touches , the film is a refreshingly serious look at young women . ","although laced with humor and a few fanciful touches , the film is a refreshingly serious look at young women . "
327,1,12,12,12,0.5757575757575758,0.9,0.9396315633883844,False,"it proves quite compelling as an intense , brooding character study . ","it evidence quite compelling as an intense , brooding character study . "
342,0,26,26,26,0.4646153846153846,0.8,0.8172411737771141,False,"in an effort , i suspect , not to offend by appearing either too serious or too lighthearted , it offends by just being wishy-washy . ","in an effort , i suspect , non to offend by appearing either too serious or too lighthearted , it offends by just being wishy-washy . "
158,1,33,33,33,1.0,1.0,1.0,False,"by getting myself wrapped up in the visuals and eccentricities of many of the characters , i found myself confused when it came time to get to the heart of the movie . ","by getting myself wrapped up in the visuals and eccentricities of many of the characters , i found myself confused when it came time to get to the heart of the movie . "
744,1,5,5,5,1.0,1.0,1.0,False,one from the heart . ,one from the heart . 
573,1,4,4,4,1.0,1.0,1.0,False,lovely and poignant . ,lovely and poignant . 
545,0,19,19,19,0.52046783625731,0.8,0.9617579574365808,False,"from the opening scenes , it 's clear that all about the benjamins is a totally formulaic movie . ","from the opening scenes , it 'randomness clear that all about the benjamins is a altogether formulaic movie . "
529,0,27,27,27,1.0,1.0,0.9999999999999998,False,"for close to two hours the audience is forced to endure three terminally depressed , mostly inarticulate , hyper dysfunctional families for the price of one . ","for close to two hours the audience is forced to endure three terminally depressed , mostly inarticulate , hyper dysfunctional families for the price of one . "
485,1,17,17,17,1.0,1.0,1.0,False,a literate presentation that wonderfully weaves a murderous event in 1873 with murderous rage in 2002 . ,a literate presentation that wonderfully weaves a murderous event in 1873 with murderous rage in 2002 . 
228,1,16,16,16,1.0,1.0,1.0000000000000002,False,it provides an honest look at a community striving to anchor itself in new grounds . ,it provides an honest look at a community striving to anchor itself in new grounds . 
685,0,16,16,16,1.0,1.0,1.0,False,no screen fantasy-adventure in recent memory has the showmanship of clones ' last 45 minutes . ,no screen fantasy-adventure in recent memory has the showmanship of clones ' last 45 minutes . 
212,0,15,15,15,1.0,1.0,1.0,False,"the entire movie is about a boring , sad man being boring and sad . ","the entire movie is about a boring , sad man being boring and sad . "
303,1,8,8,8,0.5714285714285714,1.0,0.9297234878718931,False,"entertains by providing good , lively company . ","entertain by providing good , live company . "
32,1,8,8,8,1.0,1.0,1.0,False,"a gorgeous , witty , seductive movie . ","a gorgeous , witty , seductive movie . "
385,0,32,32,32,0.8104838709677419,0.9,0.9775473597127571,False,"while the resident evil games may have set new standards for thrills , suspense , and gore for video games , the movie really only succeeds in the third of these . ","while the resident evil games may have set young standards for thrills , suspense , and panel for video games , the flick really only succeeds in the third of these . "
513,0,31,31,31,0.5225806451612903,0.7,0.7701944096437615,False,"care deftly captures the wonder and menace of growing up , but he never really embraces the joy of fuhrman 's destructive escapism or the grace-in-rebellion found by his characters . ","care deftly entrance the wonder and menace of growing up , but he never really embraces the joy of fuhrman 's destructive escapism or the grace-in-rebellion found by his characters . "
