id,pred_label,orig_len,aug_len,aligned_tokens,kendall_tau,top_k_overlap,cosine_similarity,flip,text,aug_text
160,0,26,26,26,0.7661538461538462,0.9,0.9804166668492409,False,"uncommonly stylish but equally silly ... the picture fails to generate much suspense , nor does it ask searching enough questions to justify its pretensions . ","uncommonly stylish but equally silly ... the picture fails to generate much suspense , nor set it ask searching enough questions to absolve its pretensions . "
149,1,30,30,29,0.6305418719211823,0.6,0.8886983067660209,False,"the volatile dynamics of female friendship is the subject of this unhurried , low-key film that is so off-hollywood that it seems positively french in its rhythms and resonance . ","the explosive dynamics of female friendship is the subject of this unhurried , crushed-key film that is hence off-hollywood that it seems positively french in its rhythms and resonance . "
264,0,18,18,17,0.5588235294117647,0.9,0.7495116125046964,False,"it ca n't decide if it wants to be a mystery/thriller , a romance or a comedy . ","it ca n'triiodothyronine decide if it wants to be a mystery/thriller , a romance or a comedy . "
435,1,8,8,8,1.0,1.0,0.9999999999999998,False,a marvel like none you 've seen . ,a marvel like none you 've seen . 
220,1,19,19,19,0.7660818713450293,0.9,0.9884118936906846,False,the socio-histo-political treatise is told in earnest strides ... ( and ) personal illusion is deconstructed with poignancy . ,the socio-histo-political treatise is told in earnest strides ... ( and ) personal illusion is deconstructed with pathos . 
678,1,27,27,27,1.0,1.0,1.0,False,"the movie is n't just hilarious : it 's witty and inventive , too , and in hindsight , it is n't even all that dumb . ","the movie is n't just hilarious : it 's witty and inventive , too , and in hindsight , it is n't even all that dumb . "
677,1,16,16,16,0.7166666666666667,0.9,0.9663608419486213,False,"majidi is an unconventional storyteller , capable of finding beauty in the most depressing places . ","majidi is an unconventional storyteller , capable of determination beauty in the most lower stead . "
602,1,11,11,11,0.7454545454545455,0.9,0.9880518085235838,False,"instead , he shows them the respect they are due . ","instead , helium shows them the respect they are due . "
784,1,11,11,11,0.5636363636363636,0.9,0.9443335201321817,False,very psychoanalytical -- provocatively so -- and also refreshingly literary . ,very psychoanalytical -- provocatively so -- and also refreshfully literary . 
