id,pred_label,orig_len,aug_len,aligned_tokens,kendall_tau,top_k_overlap,cosine_similarity,flip,text,aug_text
265,0,27,27,27,0.50997150997151,0.6,0.9084576864228792,False,"paid in full is so stale , in fact , that its most vibrant scene is one that uses clips from brian de palma 's scarface . ","paid in full is thus stale , in fact , that its most vibrant scene is peerless that utilisation clips from brian de palma 's scarface . "
297,1,13,13,13,1.0,1.0,1.0000000000000002,False,travels a fascinating arc from hope and euphoria to reality and disillusionment . ,travels a fascinating arc from hope and euphoria to reality and disillusionment . 
701,0,34,34,34,0.42245989304812837,0.7,0.7635827532848155,False,"even the finest chef ca n't make a hotdog into anything more than a hotdog , and robert de niro ca n't make this movie anything more than a trashy cop buddy comedy . ","even the ok chef ca n't cause a hotdog into anything more than a hotdog , and robert de niro ca n't shit this movie anything more than a trashy cop buddy comedy . "
700,0,21,21,20,0.2736842105263158,0.6,0.7157085032553311,False,"is the time really ripe for a warmed-over james bond adventure , with a village idiot as the 007 clone ? ","is the time really ripe for a warmed-terminated james bond hazard , with a hamlet idiot as the 007 clone ? "
821,1,18,18,17,0.9558823529411765,1.0,0.9984853501225001,False,"exciting and direct , with ghost imagery that shows just enough to keep us on our toes . ","exciting and direct , with ghost imagery that shows just enough to keep America on our toes . "
190,0,33,33,33,0.48863636363636365,0.7,0.8035862314395862,False,"try as i may , i ca n't think of a single good reason to see this movie , even though everyone in my group extemporaneously shouted , ` thank you ! ' ","stress as i may , i ca n't think of a single good conclude to see this movie , even though everyone in my group extemporaneously scream , ` thank you ! ' "
667,0,7,7,7,1.0,1.0,1.0,False,"good film , but very glum . ","good film , but very glum . "
236,1,25,25,25,1.0,1.0,1.0,False,not since japanese filmmaker akira kurosawa 's ran have the savagery of combat and the specter of death been visualized with such operatic grandeur . ,not since japanese filmmaker akira kurosawa 's ran have the savagery of combat and the specter of death been visualized with such operatic grandeur . 
682,0,20,20,20,0.9052631578947369,1.0,0.998179924175206,False,"in the end , the movie collapses on its shaky foundation despite the best efforts of director joe carnahan . ","in the end , the movie collapses on its shaky foundation despite the best drive of director joe carnahan . "
150,1,11,11,11,1.0,1.0,1.0,False,overall very good for what it 's trying to do . ,overall very good for what it 's trying to do . 
230,0,20,20,20,0.47368421052631576,0.7,-0.9576271543879245,True,reign of fire looks as if it was made without much thought -- and is best watched that way . ,reign of fire looks as if it was made without often thought -- and is best watched that way . 
656,0,13,13,13,1.0,1.0,1.0000000000000002,False,"so much facile technique , such cute ideas , so little movie . ","so much facile technique , such cute ideas , so little movie . "
751,0,6,6,6,0.8666666666666667,1.0,0.9979005299198475,False,one long string of cliches . ,one long strand of cliches . 
191,1,31,31,31,0.9225806451612903,0.9,0.9990705281973069,False,the movie is beautiful to behold and engages one in a sense of epic struggle -- inner and outer -- that 's all too rare in hollywood 's hastier productions . ,the movie is beautiful to behold and engages one in a sense of epic struggle -- inner and forbidden -- that 's all too rare in hollywood 's hastier productions . 
133,0,36,36,36,0.8920634920634921,1.0,0.9979719109305512,False,"the tale of tok ( andy lau ) , a sleek sociopath on the trail of o ( takashi sorimachi ) , the most legendary of asian hitmen , is too scattershot to take hold . ","the tale of tok ( andy lau ) , a sleek sociopath on the trail of oxygen ( takashi sorimachi ) , the most legendary of asian hitmen , is too scattershot to take hold . "
72,1,8,8,8,1.0,1.0,1.0000000000000002,False,uses high comedy to evoke surprising poignance . ,uses high comedy to evoke surprising poignance . 
544,1,21,21,21,1.0,1.0,1.0000000000000002,False,"although huppert 's intensity and focus has a raw exhilaration about it , the piano teacher is anything but fun . ","although huppert 's intensity and focus has a raw exhilaration about it , the piano teacher is anything but fun . "
219,1,30,30,30,0.5678160919540229,0.7,0.6938799090784862,False,"what the film lacks in general focus it makes up for in compassion , as corcuera manages to find the seeds of hope in the form of collective action . ","what the film miss in general focus it makes up for in compassion , as corcuera manages to find the seeds of hope in the form of collective action . "
762,1,13,13,13,0.46153846153846156,0.7,0.8398086188980023,False,it 's a lovely film with lovely performances by buy and accorsi . ,it 'randomness a lovely film with lovely operation by buy and accorsi . 
301,0,33,33,33,0.2803030303030303,0.7,0.6945613927603754,False,"the x potion gives the quickly named blossom , bubbles and buttercup supernatural powers that include extraordinary strength and laser-beam eyes , which unfortunately do n't enable them to discern flimsy screenplays . ","the x potion hold the quickly named blossom , bubbles and buttercup supernatural powers that admit extraordinary enduringness and laser-beam eyes , which unfortunately do n't enable them to spot flimsy screenplays . "
30,1,28,28,28,0.6984126984126984,0.9,0.9329849567250865,False,"thanks to scott 's charismatic roger and eisenberg 's sweet nephew , roger dodger is one of the most compelling variations on in the company of men . ","thank to scott 's charismatic roger and eisenberg 's sweet nephew , roger dodger is one of the most compelling fluctuation on in the company of men . "
441,0,27,27,27,1.0,1.0,1.0000000000000002,False,"there is very little dread or apprehension , and though i like the creepy ideas , they are not executed with anything more than perfunctory skill . ","there is very little dread or apprehension , and though i like the creepy ideas , they are not executed with anything more than perfunctory skill . "
129,1,19,19,19,0.7894736842105263,0.9,0.9643700259287789,False,"it provides the grand , intelligent entertainment of a superior cast playing smart people amid a compelling plot . ","it provides the grand , intelligent entertainment of a superior cast diddle smart people amid a compelling plot . "
868,1,8,8,8,1.0,1.0,1.0000000000000002,False,a movie with a real anarchic flair . ,a movie with a real anarchic flair . 
623,1,13,13,13,1.0,1.0,1.0,False,"it is amusing , and that 's all it needs to be . ","it is amusing , and that 's all it needs to be . "
14,0,25,25,25,0.7,0.9,0.8922625852231219,False,even horror fans will most likely not find what they 're seeking with trouble every day ; the movie lacks both thrills and humor . ,even horror fans will nigh likely not find what they 're seek with trouble every day ; the movie lacks both thrills and wittiness . 
282,0,29,29,28,0.4497354497354497,0.8,0.5386489668093597,False,"while there 's something intrinsically funny about sir anthony hopkins saying ` get in the car , bitch , ' this jerry bruckheimer production has little else to offer ","while there 's something intrinsically funny about sir anthony hopkins saying ` stick in the car , bitch , ' this Hun bruckheimer production has piffling else to offer "
862,0,42,42,42,0.5609756097560976,0.6,0.9509963115743655,False,"it 's inoffensive , cheerful , built to inspire the young people , set to an unending soundtrack of beach party pop numbers and aside from its remarkable camerawork and awesome scenery , it 's about as exciting as a sunburn . ","it 's inoffensive , cheerful , built to inspire the untried people , set to an unending soundtrack of beach party pop number and excursus from its noteworthy camerawork and awesome scenery , it 's about as exciting as a sunburn . "
86,0,21,21,21,1.0,1.0,0.9999999999999999,False,"the film flat lines when it should peak and is more missed opportunity and trifle than dark , decadent truffle . ","the film flat lines when it should peak and is more missed opportunity and trifle than dark , decadent truffle . "
813,0,26,26,26,0.8953846153846153,1.0,0.9967926442541687,False,i can take infantile humor ... but this is the sort of infantile that makes you wonder about changing the director and writer 's diapers . ,i can take infantile humor ... but this is the sort of infantile that makes you wonder about changing the director and writer 's diaper . 
829,1,8,8,8,1.0,1.0,1.0,False,teen movies have really hit the skids . ,teen movies have really hit the skids . 
825,1,27,27,27,0.886039886039886,1.0,0.9958725589904167,False,candid and comfortable ; a film that deftly balances action and reflection as it lets you grasp and feel the passion others have for their work . ,candid and comfortable ; a film that deftly poise action and reflection as it lets you grasp and feel the passion others have for their work . 
268,0,24,24,24,0.6231884057971014,0.9,0.9611765383422459,False,a dumb movie with dumb characters doing dumb things and you have to be really dumb not to see where this is going . ,a obtuse movie with dumb characters doing dumb things and you have to be really dumb not to see where this is going . 
461,0,20,20,20,0.7368421052631579,0.8,0.9301027233825807,False,it 's too bad that the helping hand he uses to stir his ingredients is also a heavy one . ,it 'randomness too bad that the helping hand he uses to stir his ingredients is likewise a heavy one . 
853,1,14,14,14,1.0,1.0,1.0000000000000002,False,"( serry ) wants to blend politics and drama , an admirable ambition . ","( serry ) wants to blend politics and drama , an admirable ambition . "
447,1,23,23,23,0.4624505928853755,0.7,0.3728043672772673,False,"generally , clockstoppers will fulfill your wildest fantasies about being a different kind of time traveler , while happily killing 94 minutes . ","generally , clockstoppers will fulfill your raging fantasies about being a different kind of time traveler , while gayly cleanup 94 minutes . "
142,0,16,16,16,1.0,1.0,1.0,False,what better message than ` love thyself ' could young women of any size receive ? ,what better message than ` love thyself ' could young women of any size receive ? 
812,1,12,12,12,1.0,1.0,1.0,False,this surreal gilliam-esque film is also a troubling interpretation of ecclesiastes . ,this surreal gilliam-esque film is also a troubling interpretation of ecclesiastes . 
262,0,38,38,38,0.8492176386913229,1.0,0.9969285528530959,False,"it 's like every bad idea that 's ever gone into an after-school special compiled in one place , minus those daytime programs ' slickness and sophistication ( and who knew they even had any ? ) . ","it 's like every bad idea that 's ever gone into an after-school special compiled in one place , minus those daylight programs ' slickness and sophistication ( and who knew they even had any ? ) . "
364,0,15,15,15,0.4857142857142857,0.8,0.9167500925895052,False,"instead of hiding pinocchio from critics , miramax should have hidden it from everyone . ","instead of cover pinocchio from critics , miramax should have hidden it from everyone . "
239,1,16,16,16,0.8166666666666667,0.9,0.9700245839116488,False,brilliantly explores the conflict between following one 's heart and following the demands of tradition . ,brilliantly search the conflict between following one 's sum and following the demands of tradition . 
498,1,18,18,18,0.8169934640522876,1.0,0.9884196119001307,False,"anchored by friel and williams 's exceptional performances , the film 's power lies in its complexity . ","anchored by friel and williams 's exceptional performances , the film 's power lies in its complexness . "
773,1,6,6,6,0.8666666666666667,1.0,0.9466234569551205,False,it 's a beautiful madness . ,it 'second a beautiful madness . 
562,0,13,13,13,1.0,1.0,1.0,False,scorsese does n't give us a character worth giving a damn about . ,scorsese does n't give us a character worth giving a damn about . 
577,1,15,15,15,0.9047619047619048,1.0,0.9994054733179975,False,"though only 60 minutes long , the film is packed with information and impressions . ","though merely 60 minutes long , the film is packed with information and impressions . "
439,1,16,16,16,1.0,1.0,0.9999999999999999,False,yakusho and shimizu ... create engaging characterizations in imamura 's lively and enjoyable cultural mix . ,yakusho and shimizu ... create engaging characterizations in imamura 's lively and enjoyable cultural mix . 
686,1,14,14,14,1.0,1.0,1.0,False,"more romantic , more emotional and ultimately more satisfying than the teary-eyed original . ","more romantic , more emotional and ultimately more satisfying than the teary-eyed original . "
372,1,37,37,37,0.5405405405405406,0.8,0.8937535665755457,False,"the special effects and many scenes of weightlessness look as good or better than in the original , while the oscar-winning sound and james horner 's rousing score make good use of the hefty audio system . ","the special effects and many scenes of weightlessness look as good or better than in the original , while the oscar-winning sound and block horner 's rousing grade make good use of the hefty audio system . "
440,0,45,45,44,0.3953488372093023,0.5,-0.6346612661552723,True,"this is wild surreal stuff , but brilliant and the camera just kind of sits there and lets you look at this and its like you 're going from one room to the next and none of them have any relation to the other . ","this is wild surreal stuff , but brilliant and the camera just kind of sits thither and lets you look at this and IT like you 're locomote from one way to the next and none of them have any relation to the other . "
653,0,17,17,17,1.0,1.0,1.0000000000000002,False,"a lackluster , unessential sequel to the classic disney adaptation of j.m. barrie 's peter pan . ","a lackluster , unessential sequel to the classic disney adaptation of j.m. barrie 's peter pan . "
321,0,7,7,7,1.0,1.0,1.0000000000000002,False,but it could have been worse . ,but it could have been worse . 
670,0,11,11,11,0.2727272727272727,0.9,0.8744540977932628,False,verbinski implements every hack-artist trick to give us the ooky-spookies . ,verbinski implements every hack-artist antic to give us the ooky-spookies . 
120,1,28,28,28,0.8518518518518519,0.8,0.9931397982757573,False,"warm water under a red bridge is a quirky and poignant japanese film that explores the fascinating connections between women , water , nature , and sexuality . ","warm water under a red bridge is a quirky and poignant japanese film that explores the fascinating connections between womanhood , water , nature , and sexuality . "
354,1,9,9,9,0.7222222222222222,1.0,0.9881806924764945,False,"the film is quiet , threatening and unforgettable . ","the take is restrained , threatening and unforgettable . "
608,1,24,24,24,1.0,1.0,0.9999999999999999,False,"highbrow self-appointed guardians of culture need not apply , but those who loved cool as ice have at last found a worthy follow-up . ","highbrow self-appointed guardians of culture need not apply , but those who loved cool as ice have at last found a worthy follow-up . "
648,1,25,25,24,0.5217391304347826,0.7,0.8656717343481306,False,"further proof that the epicenter of cool , beautiful , thought-provoking foreign cinema is smack-dab in the middle of dubya 's axis of evil . ","further proof that the epicentre of cool , beautiful , thought-chivvy foreign cinema is smack-dab in the middle of dubya 's axis of evil . "
269,0,20,20,20,0.5894736842105263,0.8,0.971094809446605,False,"with virtually no interesting elements for an audience to focus on , chelsea walls is a triple-espresso endurance challenge . ","with virtually no interesting elements for an audience to focus on , chelsea palisade is a triple-espresso endurance challenge . "
707,0,11,11,11,0.9636363636363636,1.0,0.9952840593917477,False,no telegraphing is too obvious or simplistic for this movie . ,no telegraphing is too obvious or simplistic for this picture . 
459,1,43,43,43,0.43964562569213733,0.5,0.7340200333255954,False,"gives you the steady pulse of life in a beautiful city viewed through the eyes of a character who , in spite of tragic loss and increasing decrepitude , knows in his bones that he is one of the luckiest men alive . ","gives you the steady pulse of life in a beautiful city viewed through the eyes of a character who , in spite of tragic loss and increasing decrepitude , eff in his bones that helium is unmatchable of the luckiest men alive . "
567,1,20,20,20,1.0,1.0,1.0,False,"feature debuter d.j. caruso directs a crack ensemble cast , bringing screenwriter tony gayton 's narcotics noir to life . ","feature debuter d.j. caruso directs a crack ensemble cast , bringing screenwriter tony gayton 's narcotics noir to life . "
625,1,15,15,15,1.0,1.0,1.0000000000000002,False,for the most part stevens glides through on some solid performances and witty dialogue . ,for the most part stevens glides through on some solid performances and witty dialogue . 
766,1,27,27,27,0.9202279202279202,1.0,0.9983117456848837,False,"while its careful pace and seemingly opaque story may not satisfy every moviegoer 's appetite , the film 's final scene is soaringly , transparently moving . ","while its careful pace and seemingly opaque story may not satisfy every moviegoer 's appetite , the film 's terminal scene is soaringly , transparently moving . "
138,1,9,9,9,1.0,1.0,1.0,False,that is a compliment to kuras and miller . ,that is a compliment to kuras and miller . 
450,1,27,27,27,0.6296296296296297,0.8,0.9588830634674705,False,"a moody , multi-dimensional love story and sci-fi mystery , solaris is a thought-provoking , haunting film that allows the seeds of the imagination to germinate . ","a moody , multi-dimensional eff story and sci-fi mystery , solaris is a thought-provoking , haunting film that allows the seeds of the imagination to germinate . "
693,0,20,20,20,1.0,1.0,1.0,False,"because of an unnecessary and clumsy last scene , ` swimfan ' left me with a very bad feeling . ","because of an unnecessary and clumsy last scene , ` swimfan ' left me with a very bad feeling . "
746,1,6,6,6,0.6,1.0,0.9244606928932327,False,people cinema at its finest . ,citizenry cinema at its finest . 
454,0,18,18,18,0.49019607843137253,0.8,0.8397023555689169,False,"even on those rare occasions when the narrator stops yammering , miller 's hand often feels unsure . ","even on those rarefied occasions when the narrator stops yammering , miller 's hand often feels unsure . "
548,0,22,22,22,0.6536796536796536,0.9,0.833348417846375,False,"i 've always dreamed of attending cannes , but after seeing this film , it 's not that big a deal . ","i 've always dreamed of attending cannes , but after seeing this film , it 's non that big a deal . "
180,0,14,14,14,1.0,1.0,1.0,False,"unfortunately , it 's not silly fun unless you enjoy really bad movies . ","unfortunately , it 's not silly fun unless you enjoy really bad movies . "
300,1,11,11,11,1.0,1.0,1.0,False,"fun , flip and terribly hip bit of cinematic entertainment . ","fun , flip and terribly hip bit of cinematic entertainment . "
207,1,7,7,7,1.0,1.0,0.9999999999999998,False,"smart , provocative and blisteringly funny . ","smart , provocative and blisteringly funny . "
183,1,12,12,12,1.0,1.0,1.0,False,"the lower your expectations , the more you 'll enjoy it . ","the lower your expectations , the more you 'll enjoy it . "
535,1,7,7,7,1.0,1.0,1.0,False,"a quiet , pure , elliptical film ","a quiet , pure , elliptical film "
832,1,17,17,17,-0.07352941176470588,0.5,-0.26011860200921005,True,manages to show life in all of its banality when the intention is quite the opposite . ,oversee to designate life in wholly of its banality when the intention is quite the opposite . 
259,1,25,25,25,0.8466666666666667,0.8,0.9929535657379112,False,a rarity among recent iranian films : it 's a comedy full of gentle humor that chides the absurdity of its protagonist 's plight . ,a rarity among recent iranian films : it 's a comedy full of gentle humor that chides the fatuity of its protagonist 's plight . 
380,0,15,15,15,0.638095238095238,0.8,0.934861779271747,False,"at its worst , it implodes in a series of very bad special effects . ","at its worst , it implodes in a series of very bad special burden . "
470,1,12,12,12,0.7272727272727273,0.9,0.9758419254986037,False,reggio 's continual visual barrage is absorbing as well as thought-provoking . ,reggio 's continual ocular barrage is absorbing as well as thought-provoking . 
839,0,12,12,12,1.0,1.0,1.0,False,but this films lacks the passion required to sell the material . ,but this films lacks the passion required to sell the material . 
620,0,27,27,27,0.7663817663817664,0.9,0.9651380096359439,False,the moviegoing equivalent of going to a dinner party and being forced to watch the host and hostess 's home video of their baby 's birth . ,the moviegoing equivalent of going to a dinner company and being forced to watch the host and hostess 's home video of their baby 's parentage . 
286,1,18,18,18,0.7516339869281046,0.9,0.9687162297966738,False,"at its best , queen is campy fun like the vincent price horror classics of the '60s . ","at its best , poove is campy fun like the vincent price horror classic of the '60s . "
405,1,15,15,15,0.29523809523809524,0.7,-0.9198900030231597,True,"outer-space buffs might love this film , but others will find its pleasures intermittent . ","outer-space buffs might love this shoot , but others will find its pleasures intermittent . "
857,1,30,30,30,1.0,1.0,0.9999999999999999,False,"visually imaginative , thematically instructive and thoroughly delightful , it takes us on a roller-coaster ride from innocence to experience without even a hint of that typical kiddie-flick sentimentality . ","visually imaginative , thematically instructive and thoroughly delightful , it takes us on a roller-coaster ride from innocence to experience without even a hint of that typical kiddie-flick sentimentality . "
591,0,9,9,9,0.6666666666666666,1.0,0.9635278303658703,False,i got a headache watching this meaningless downer . ,iodine got a headache watching this meaningless downer . 
502,0,14,14,12,0.9696969696969697,1.0,0.9986564379644421,False,"deadeningly dull , mired in convoluted melodrama , nonsensical jargon and stiff-upper-lip laboriousness . ","deadeningly dull , mired in Byzantine melodrama , nonsensical jargon and stiff-amphetamine-lip laboriousness . "
563,1,17,17,17,1.0,1.0,0.9999999999999998,False,"with rabbit-proof fence , noyce has tailored an epic tale into a lean , economical movie . ","with rabbit-proof fence , noyce has tailored an epic tale into a lean , economical movie . "
241,0,14,14,14,1.0,1.0,0.9999999999999998,False,it appears that something has been lost in the translation to the screen . ,it appears that something has been lost in the translation to the screen . 
578,0,4,4,4,1.0,1.0,1.0000000000000002,False,just not campy enough ,just not campy enough 
786,0,37,37,37,0.6666666666666666,0.7,0.9415360703833123,False,the film makes a fatal mistake : it asks us to care about a young man whose only apparent virtue is that he is not quite as unpleasant as some of the people in his life . ,the film makes a fatal error : it asks us to tending about a young man whose only apparent virtue is that he is not quite as unpleasant as some of the people in his life . 
199,0,30,30,30,0.9218390804597701,0.9,0.9979499799587047,False,"at the very least , if you do n't know anything about derrida when you walk into the theater , you wo n't know much more when you leave . ","at the very least , if you manage n't know anything about derrida when you walk into the theater , you wo n't know much more when you leave . "
718,1,13,13,13,0.8461538461538461,1.0,0.9966097410722787,False,"this is human comedy at its most amusing , interesting and confirming . ","this is human comedy at its most funny , interesting and confirming . "
375,0,13,13,12,0.21212121212121213,0.8,-0.40102627288773757,True,we have n't seen such hilarity since say it is n't so ! ,we have n't seen such hilarity since say it is n'thymine so ! 
134,0,18,18,18,0.8300653594771242,0.9,0.9473947729933343,False,it all drags on so interminably it 's like watching a miserable relationship unfold in real time . ,it all drags on so interminably it 's like watching a miserable relationship unfold in real metre . 
75,1,10,10,10,1.0,1.0,0.9999999999999999,False,among the year 's most intriguing explorations of alientation . ,among the year 's most intriguing explorations of alientation . 
823,1,13,13,13,0.5897435897435898,0.8,0.9631424986827816,False,it wants to tweak them with a taste of tangy new humor . ,it wants to tweak them with a taste of lemonlike new humor . 
666,1,16,16,16,0.6333333333333333,0.9,0.8756540125513286,False,richard gere and diane lane put in fine performances as does french actor oliver martinez . ,richard gere and diane lane assign in fine performances as does french actor oliver martinez . 
644,1,33,33,31,0.5311827956989247,0.8,0.7374895687560208,False,"while locals will get a kick out of spotting cleveland sites , the rest of the world will enjoy a fast-paced comedy with quirks that might make the award-winning coen brothers envious . ","while locals will get a kick out of spotting cleveland sites , the rest of the world bequeath enjoy a degenerate-paced comedy with quirks that might make the award-gain coen brothers envious . "
474,0,11,11,11,1.0,1.0,1.0,False,the problem with this film is that it lacks focus . ,the problem with this film is that it lacks focus . 
